EPSS34,CAPITAL SALUD,800065396.0,INSTITUTO DE DIAGNOSTICO MEDICO S.A.,Evento,708337718.0,Abril 2024,Evento
EPSS34,CAPITAL SALUD,800067908.0,RADIOTERAPIA ONCOLOGIA MARLY S.A,Evento,22500000.0,Abril 2024,Evento
EPSS34,CAPITAL SALUD,800084206.0,EMPRESA SOCIAL DEL ESTADO INSTITUTO DE SALUD DE BUCARAMANGA,Evento,2209539.0,Abril 2024,Evento
EPSS34,CAPITAL SALUD,800099860.0,E.S.E. HOSPITAL SAN RAFAEL DE PACHO,Evento,18151024.0,Abril 2024,Evento
EPSS34,CAPITAL SALUD,800149384.0,CLINICA COLSANITAS SA,Evento,12838821.0,Abril 2024,Evento
EPSS34,CAPITAL SALUD,800149453.0,CPO SA,Evento,91104387.0,Abril 2024,Evento
EPSS34,CAPITAL SALUD,800154347.0,EMPRESA SOCIAL DEL ESTADO HOSPITAL LA CANDELARIA,Evento,2970189.0,Abril 2024,Evento
EPSS34,CAPITAL SALUD,800156469.0,IMÁGENES DIAGNOSTICAS DEL LLANO S.A.,Evento,170603000.0,Abril 2024,Evento
EPSS34,CAPITAL SALUD,800162035.0,SERVICIOS MEDICOS INTEGRALES DE SALUD SAS SERVIMEDICOS SAS,Evento,845916500.0,Abril 2024,Evento
EPSS34,CAPITAL SALUD,800175901.0,CLINICA EMPERATRIZ SAS,Evento,220980307.0,Abril 2024,Evento
EPSS34,CAPITAL SALUD,800182136.0,HOSPITAL SAN ANTONIO E.S.E. DE NATAGAIMA TOLIMA,Evento,1486465.0,Abril 2024,Evento
EPSS34,CAPITAL SALUD,800200789.0,CLINICA CHIA S.A.S.,Evento,1477346.0,Abril 2024,Evento
EPSS34,CAPITAL SALUD,800231235.0,EMPRESA SOCIAL DEL ESTADO HOSPITAL UNIVERSITARIO SAN JORGE,Evento,17757311.0,Abril 2024,Evento
EPSS34,CAPITAL SALUD,800247350.0,EMPRESA SOCIAL DEL ESTADO CENTRO DERMATOLOGICO FEDERICO LLERAS ACOSTA,Evento,48035462.0,Abril 2024,Evento
EPSS34,CAPITAL SALUD,800251482.0,HOGARES DE PASO LA MALOKA SAS,Evento,35698828.0,Abril 2024,Evento
EPSS34,CAPITAL SALUD,804014839.0,INSTITUTO DEL CORAZÓN DE BUCARAMANGA S.A.,Evento,1031243763.0,Abril 2024,Evento
EPSS34,CAPITAL SALUD,804015920.0,E.S.E NUESTRA SEÑORA DE LA PAZ,Evento,1111205.0,Abril 2024,Evento
EPSS34,CAPITAL SALUD,805011262.0,RTS S.A.S,Evento,380079350.0,Abril 2024,Evento
EPSS34,CAPITAL SALUD,805027743.0,DUMIAN MÉDICAL S.A.S,Evento,13793137.0,Abril 2024,Evento
EPSS34,CAPITAL SALUD,807004631.0,E.S.E.HOSPITAL LOCAL VILLA DEL ROSARIO,Evento,1485743.0,Abril 2024,Evento
EPSS34,CAPITAL SALUD,810000913.0,EMPRESA SOCIAL DEL ESTADO HOSPITAL SAN FELIX LA DORADA CALDAS,Evento,7488108.0,Abril 2024,Evento
EPSS34,CAPITAL SALUD,811004956.0,FUNDACIÓN LA LUZ - CENTRO NACIONAL PARA EL TRATAMIENTO DE LA DROGADICCIÓN,Evento,103974694.0,Abril 2024,Evento
EPSS34,CAPITAL SALUD,811016192.0,HOSPITAL ALMA MÁTER DE ANTIOQUIA,Evento,3558939.0,Abril 2024,Evento
EPSS34,CAPITAL SALUD,812005522.0,FUNDACION AMIGOS DE LA SALUD,Evento,27299879.0,Abril 2024,Evento
EPSS34,CAPITAL SALUD,813001653.0,EMPRESA SOCIAL DEL ESTADO HOSPITAL MUNICIPAL DE ALGECIRAS,Evento,1393762.0,Abril 2024,Evento
EPSS34,CAPITAL SALUD,813001952.0,CLINICA MEDILASER S.A.S.,Evento,95920364.0,Abril 2024,Evento
EPSS34,CAPITAL SALUD,813010996.0,ESE HOSPITAL SAN JOSE DE ISNOS,Evento,1342850.0,Abril 2024,Evento
EPSS34,CAPITAL SALUD,813011577.0,CLINICA UROS S.A.S - TORRE A,Evento,47270358.0,Abril 2024,Evento
EPSS34,CAPITAL SALUD,815000316.0,E.S.E. HOSPITAL RAUL OREJUELA BUENO,Evento,1441672.0,Abril 2024,Evento
EPSS34,CAPITAL SALUD,816001182.0,AUDIFARMA S.A.,Evento,6172677165.0,Abril 2024,Evento
EPSS34,CAPITAL SALUD,820003850.0,EMPRESA SOCIAL DEL ESTADO SANTIAGO DE TUNJA,Evento,2763636.0,Abril 2024,Evento
EPSS34,CAPITAL SALUD,820005389.0,EMPRESA SOCIAL DEL ESTADO HOSPITAL REGIONAL DE CHIQUINQUIRA,Evento,8326203.0,Abril 2024,Evento
EPSS34,CAPITAL SALUD,822000327.0,COOPERATIVA DE UROLOGOS DEL META Y LA ORINOQUIA CUMO,Evento,79486285.0,Abril 2024,Evento
EPSS34,CAPITAL SALUD,822000946.0,MEDICINA NUCLEAR DIAGNOSTICA S.A.S.,Evento,13570659.0,Abril 2024,Evento
EPSS34,CAPITAL SALUD,822001338.0,CLINICA DEL SISTEMA NERVIOSO S.A.S,Evento,809006250.0,Abril 2024,Evento
EPSS34,CAPITAL SALUD,822001570.0,HOSPITAL LOCAL PRIMER NIVEL E.S.E. FUENTE DE ORO,Evento,8773445.0,Abril 2024,Evento
EPSS34,CAPITAL SALUD,822002459.0,EMPRESA SOCIAL DEL ESTADO DEL MUNICIPIO DE VILLAVICENCIO,Evento,16336203.0,Abril 2024,Evento
EPSS34,CAPITAL SALUD,822006595.0,EMPRESA SOCIAL DEL ESTADO DEL DEPARTAMENTO DEL META ESE SOLUCION SALUD,Evento,18350267.0,Abril 2024,Evento
EPSS34,CAPITAL SALUD,822007837.0,AMBULANCIAS DEL LLANO SAS,Evento,199640214.0,Abril 2024,Evento
EPSS34,CAPITAL SALUD,824001041.0,CLINICA MEDICOS S.A.,Evento,84121752.0,Abril 2024,Evento
EPSS34,CAPITAL SALUD,830017370.0,VIVIR IPS SAS,Evento,250198548.0,Abril 2024,Evento
EPSS34,CAPITAL SALUD,830020398.0,SAN LUIS UNIDAD DE CRONICOS Y PALIATIVOS SAS,Evento,37292477.0,Abril 2024,Evento
EPSS34,CAPITAL SALUD,830054059.0,JDN MEDICAL IPS SAS,Evento,36999535.0,Abril 2024,Evento
EPSS34,CAPITAL SALUD,830058292.0,UROBOSQUE S.A,Evento,41200013.0,Abril 2024,Evento
EPSS34,CAPITAL SALUD,830071938.0,SOCIEDAD PEDIATRICA DE LOS ANDES S.A.S - SPLA S.A.S.,Evento,16170000.0,Abril 2024,Evento
EPSS34,CAPITAL SALUD,830090073.0,ASOCIACION DE AMIGOS CONTRA EL CANCER PROSEGUIR,Evento,197971450.0,Abril 2024,Evento
EPSS34,CAPITAL SALUD,830104627.0,HOSPITAL CARDIOVASCULAR DE CUNDINAMARCA S.A,Evento,1122167736.0,Abril 2024,Evento
EPSS34,CAPITAL SALUD,830107855.0,MACROMED SAS,Evento,218863123.0,Abril 2024,Evento
EPSS34,CAPITAL SALUD,830108095.0,FUNDACION SUEÑO VIGILIA COLOMBIANA FUNDASUVICOL,Evento,91510200.0,Abril 2024,Evento
EPSS34,CAPITAL SALUD,830140988.0,DENTOLASER S.A.S.,Evento,106488500.0,Abril 2024,Evento
EPSS34,CAPITAL SALUD,830507718.0,CLINICA MEDICAL SAS,Evento,758087809.0,Abril 2024,Evento
EPSS34,CAPITAL SALUD,830511298.0,MULTISALUD SAS,Evento,40520673.0,Abril 2024,Evento
EPSS34,CAPITAL SALUD,830512772.0,SIKUANY S.A.S,Evento,766708656.0,Abril 2024,Evento
EPSS34,CAPITAL SALUD,832000029.0,E.S.E. HOSPITAL HILARIO LUGO DE SASAIMA,Evento,3586950.0,Abril 2024,Evento
EPSS34,CAPITAL SALUD,832001411.0,E.S.E. HOSPITAL SAN RAFAEL DE CAQUEZA,Evento,11535981.0,Abril 2024,Evento
EPSS34,CAPITAL SALUD,832001465.0,E.S.E. HOSPITAL SAN ANTONIO DE ANOLAIMA,Evento,3513000.0,Abril 2024,Evento
EPSS34,CAPITAL SALUD,832001794.0,EMPRESA SOCIAL DEL ESTADO E.S.E MUNICIPAL DE SOACHA JULIO CESAR PEÑALOZA,Evento,34554450.0,Abril 2024,Evento
EPSS34,CAPITAL SALUD,832001966.0,ESE HOSPITAL SAN JOSE DEL GUAVIARE,Evento,33866690.0,Abril 2024,Evento
EPSS34,CAPITAL SALUD,832010436.0,HOSPITAL MARIA AUXILIADORA EMPRESA SOCIAL DEL ESTADO DEL MUNICIPIO DE MOSQUERA,Evento,4876301.0,Abril 2024,Evento
EPSS34,CAPITAL SALUD,835000972.0,HOSPITAL LUIS ABLANQUE DE LA PLATA EMPRESA SOCIAL DEL ESTADO,Evento,8705968.0,Abril 2024,Evento
EPSS34,CAPITAL SALUD,838000096.0,E.S.E. HOSPITAL SAN RAFAEL DE LETICIA,Evento,1513114.0,Abril 2024,Evento
EPSS34,CAPITAL SALUD,840001036.0,CENTRO HOSPITAL DIVINO NIÑO EMPRESA SOCIAL DEL ESTADO,Evento,2811169.0,Abril 2024,Evento
EPSS34,CAPITAL SALUD,844004197.0,RED SALUD CASANARE E.S.E.,Evento,16528932.0,Abril 2024,Evento
EPSS34,CAPITAL SALUD,845000038.0,EMPRESA SOCIAL DEL ESTADO HOSPITAL SAN ANTONIO,Evento,1594298.0,Abril 2024,Evento
EPSS34,CAPITAL SALUD,846000253.0,EMPRESA SOCIAL DEL ESTADO HOSPITAL LOCAL,Evento,1442378.0,Abril 2024,Evento
EPSS34,CAPITAL SALUD,846000471.0,ESE HOSPITAL SAGRADO CORAZON DE JESUS,Evento,1958562.0,Abril 2024,Evento
EPSS34,CAPITAL SALUD,846000474.0,E.S.E HOSPITAL ORITO,Evento,1304493.0,Abril 2024,Evento
EPSS34,CAPITAL SALUD,860001475.0,CLÍNICA SANTO TOMÁS SA,Evento,2421511.0,Abril 2024,Evento
EPSS34,CAPITAL SALUD,860002541.0,CLINICA DE MARLY S.A,Evento,2932253.0,Abril 2024,Evento
EPSS34,CAPITAL SALUD,860002566.0,FLOTA LA MACARENA S.A.,Evento,281623650.0,Abril 2024,Evento
EPSS34,CAPITAL SALUD,860006656.0,FUNDACION ABOOD SHAIO,Evento,39202966.0,Abril 2024,Evento
EPSS34,CAPITAL SALUD,860007336.0,CAJA COLOMBIANA DE SUBSIDIO FAMILIAR COLSUBSIDIO,Evento,22072185.0,Abril 2024,Evento
EPSS34,CAPITAL SALUD,860007373.0,FUNDACION HOSPITAL SAN CARLOS,Evento,123917212.0,Abril 2024,Evento
EPSS34,CAPITAL SALUD,860009555.0,E.S.E. HOSPITAL SANTA MATILDE DE MADRID,Evento,3439346.0,Abril 2024,Evento
EPSS34,CAPITAL SALUD,860010783.0,CONGREGACION DE DOMINICAS DE SANTA CATALINA DE SENA,Evento,13980658.0,Abril 2024,Evento
EPSS34,CAPITAL SALUD,860013779.0,ASOCIACIÓN PROFAMILIA,Evento,29384975.0,Abril 2024,Evento
EPSS34,CAPITAL SALUD,860013874.0,INSTITUTO ROOSEVELT,Evento,165132696.0,Abril 2024,Evento
EPSS34,CAPITAL SALUD,860015536.0,HOSPITAL UNIVERSITARIO SAN IGNACIO,Evento,535187643.0,Abril 2024,Evento
EPSS34,CAPITAL SALUD,860015905.0,CLINICA NUESTRA SEÑORA DE LA PAZ,Evento,33618887.0,Abril 2024,Evento
EPSS34,CAPITAL SALUD,860020094.0,ESE HOSPITAL NUESTRA SEÑORA DEL CARMEN DE EL COLEGIO,Evento,4206364.0,Abril 2024,Evento
EPSS34,CAPITAL SALUD,860035447.0,E.S.E. HOSPITAL SAN ANTONIO DE GUATAVITA,Evento,1816450.0,Abril 2024,Evento
EPSS34,CAPITAL SALUD,860035992.0,FUNDACION CARDIO INFANTIL INSTITUTO DE CARDIOLOGIA,Evento,625316023.0,Abril 2024,Evento
EPSS34,CAPITAL SALUD,860037592.0,EMPRESA SOCIAL DEL ESTADO HOSPITAL SANTA ROSA DE TENJO,Evento,1108194.0,Abril 2024,Evento
EPSS34,CAPITAL SALUD,860037950.0,FUNDACION SANTA FE DE BOGOTA,Evento,536634397.0,Abril 2024,Evento
EPSS34,CAPITAL SALUD,860090566.0,CLINICA DEL OCCIDENTE S.A.,Evento,98307895.0,Abril 2024,Evento
EPSS34,CAPITAL SALUD,890000600.0,EMPRESA SOCIAL DEL ESTADO HOSPITAL LA MISERICORDIA IPS,Evento,1267338.0,Abril 2024,Evento
EPSS34,CAPITAL SALUD,890202024.0,EMPRESA SOCIAL DEL ESTADO HOSPITAL SAN JUAN DE DIOS DE FLORIDABLANCA,Evento,16913530.0,Abril 2024,Evento
EPSS34,CAPITAL SALUD,890204789.0,E.S.E. HOSPITAL INTEGRADO SAN ANTONIO,Evento,1387612.0,Abril 2024,Evento
EPSS34,CAPITAL SALUD,890205456.0,ESE HOSPITAL INTEGRADO SAN BERNARDO,Evento,1010100.0,Abril 2024,Evento
EPSS34,CAPITAL SALUD,890303461.0,E.S.E. HOSPITAL UNIVERSITARIO DEL VALLE EVARISTO GARCIA EMPRESA SOCIAL DEL ESTADO,Evento,21922998.0,Abril 2024,Evento
EPSS34,CAPITAL SALUD,890480135.0,FUNDACION HOSPITAL INFANTIL NAPOLEON FRANCO PAREJA,Evento,3107595.0,Abril 2024,Evento
EPSS34,CAPITAL SALUD,890501438.0,E.S.E. HOSPITAL EMIRO QUINTERO CAÑIZARES,Evento,2007393.0,Abril 2024,Evento
EPSS34,CAPITAL SALUD,890680025.0,E.S.E. HOSPITAL SAN RAFAEL DE FUSAGASUGA,Evento,208907658.0,Abril 2024,Evento
EPSS34,CAPITAL SALUD,890680027.0,E.S.E. HOSPITAL PEDRO LEON ALVAREZ DIAZ,Evento,13008776.0,Abril 2024,Evento
EPSS34,CAPITAL SALUD,890680031.0,E.S.E. HOSPITAL SAN ANTONIO DE ARBELAEZ,Evento,4385097.0,Abril 2024,Evento
EPSS34,CAPITAL SALUD,890680032.0,EMPRESA SOCIAL DEL ESTADO HOSPITAL SAN FRANCISCO DE VIOTA,Evento,1370780.0,Abril 2024,Evento
EPSS34,CAPITAL SALUD,890680033.0,E.S.E. HOSPITAL MARCO FELIPE AFANADOR DE TOCAIMA,Evento,2163241.0,Abril 2024,Evento
EPSS34,CAPITAL SALUD,890700666.0,HOSPITAL SAN JUAN DE DIOS HONDA EMPRESA SOCIAL DEL ESTADO,Evento,14634971.0,Abril 2024,Evento
EPSS34,CAPITAL SALUD,890700967.0,HOSPITAL SAN JOSE DE ORTEGA,Evento,1379550.0,Abril 2024,Evento
EPSS34,CAPITAL SALUD,890701353.0,NUEVO HOSPITAL LA CANDELARIA,Evento,6400898.0,Abril 2024,Evento
EPSS34,CAPITAL SALUD,890701459.0,E.S.E. HOSPITAL SAN JUAN BAUTISTA,Evento,8079931.0,Abril 2024,Evento
EPSS34,CAPITAL SALUD,890702190.0,HOSPITAL SUMAPAZ E.S.E.,Evento,1001075.0,Abril 2024,Evento
EPSS34,CAPITAL SALUD,890702369.0,E.S.E. CENTRAL DE URGENCIAS LOUIS PASTEUR,Evento,2961622.0,Abril 2024,Evento
EPSS34,CAPITAL SALUD,890704495.0,HOSPITAL SAN ROQUE EMPRESA SOCIAL DEL ESTADO NIVEL I,Evento,1471980.0,Abril 2024,Evento
EPSS34,CAPITAL SALUD,890706067.0,HOSPITAL SAN JOSÉ,Evento,2215723.0,Abril 2024,Evento
EPSS34,CAPITAL SALUD,890706823.0,HOSPITAL REINA SOFIA DE ESPAÑA EMPRESA SOCIAL DEL ESTADO LERIDA TOLIMA,Evento,3070502.0,Abril 2024,Evento
EPSS34,CAPITAL SALUD,890706833.0,E.S.E. HOSPITAL FEDERICO LLERAS ACOSTA,Evento,57909539.0,Abril 2024,Evento
EPSS34,CAPITAL SALUD,890802036.0,E.S.E. HOSPITAL SAN MARCOS,Evento,1710720.0,Abril 2024,Evento
EPSS34,CAPITAL SALUD,890900518.0,FUNDACION HOSPITALARIA SAN VICENTE DE PAUL,Evento,21343458.0,Abril 2024,Evento
EPSS34,CAPITAL SALUD,890901826.0,HOSPITAL PABLO TOBON URIBE,Evento,2386685.0,Abril 2024,Evento
EPSS34,CAPITAL SALUD,890902922.0,UNIVERSIDAD PONTIFICIA BOLIVARIANA,Evento,7388987.0,Abril 2024,Evento
EPSS34,CAPITAL SALUD,890904646.0,HOSPITAL GENERAL DE MEDELLIN LUZ CASTRO DE GUTIERREZ EMPRESA SOCIAL DEL ESTADO,Evento,5921318.0,Abril 2024,Evento
EPSS34,CAPITAL SALUD,890905177.0,E.S.E. HOSPITAL LA MARIA,Evento,19992701.0,Abril 2024,Evento
EPSS34,CAPITAL SALUD,890906347.0,ESE HOSPITAL MANUEL URIBE ANGEL,Evento,8834855.0,Abril 2024,Evento
EPSS34,CAPITAL SALUD,890980757.0,ESE HOSPITAL CESAR URIBE PIEDRAHITA,Evento,3074491.0,Abril 2024,Evento
EPSS34,CAPITAL SALUD,890985703.0,E.S.E. HOSPITAL MARCO FIDEL SUAREZ,Evento,1100992.0,Abril 2024,Evento
EPSS34,CAPITAL SALUD,891079999.0,ESE HOSPITAL SAN JERÓNIMO DE MONTERÍA,Evento,12442908.0,Abril 2024,Evento
EPSS34,CAPITAL SALUD,891180026.0,E.S.E. HOSPITAL DEPARTAMENTAL SAN VICENTE DE PAUL DE GARZON,Evento,5825533.0,Abril 2024,Evento
EPSS34,CAPITAL SALUD,891180098.0,HOSPITAL DEPARTAMENTAL MARIA INMACULADA ESE,Evento,18015260.0,Abril 2024,Evento
EPSS34,CAPITAL SALUD,891180117.0,E.S.E. HOSPITAL DEPARTAMENTAL SAN ANTONIO DE PADUA DE LA PLATA,Evento,1293188.0,Abril 2024,Evento
EPSS34,CAPITAL SALUD,891180134.0,E.S.E. HOSPITAL DEPARTAMENTAL SAN ANTONIO DE PITALITO,Evento,10585590.0,Abril 2024,Evento
EPSS34,CAPITAL SALUD,891180268.0,E.S.E. HOSPITAL UNIVERSITARIO HERNANDO MONCALEANO PERDOMO DE NEIVA,Evento,49597039.0,Abril 2024,Evento
EPSS34,CAPITAL SALUD,891200528.0,E.S.E. HOSPITAL UNIVERSITARIO DEPARTAMENTAL DE NARIÑO,Evento,5108736.0,Abril 2024,Evento
EPSS34,CAPITAL SALUD,891200679.0,EMPRESA SOCIAL DEL ESTADO HOSPITAL JOSÉ MARÍA HERNÁNDEZ,Evento,4216520.0,Abril 2024,Evento
EPSS34,CAPITAL SALUD,891380054.0,FUNDACION HOSPITAL SAN JOSE DE BUGA,Evento,1969525.0,Abril 2024,Evento
EPSS34,CAPITAL SALUD,891409025.0,ESE HOSPITAL SAN RAFAEL,Evento,4392503.0,Abril 2024,Evento
EPSS34,CAPITAL SALUD,891500084.0,HOSPITAL FRANCISCO DE PAULA SANTANDER E.S.E. NIVEL II,Evento,1843833.0,Abril 2024,Evento
EPSS34,CAPITAL SALUD,891501676.0,HOSPITAL SUSANA LOPEZ DE VALENCIA EMPRESA SOCIAL DEL ESTADO,Evento,8315976.0,Abril 2024,Evento
EPSS34,CAPITAL SALUD,891580002.0,HOSPITAL UNIVERSITARIO SAN JOSE DE POPAYAN E.S.E.,Evento,23367855.0,Abril 2024,Evento
EPSS34,CAPITAL SALUD,891800231.0,EMPRESA SOCIAL DEL ESTADO HOSPITAL UNIVERSITARIO SAN RAFAEL DE TUNJA,Evento,78856414.0,Abril 2024,Evento
EPSS34,CAPITAL SALUD,891800611.0,EMPRESA SOCIAL DEL ESTADO HOSPITAL SAN ANTONIO DE SOATA,Evento,3496900.0,Abril 2024,Evento
EPSS34,CAPITAL SALUD,891855029.0,HOSPITAL REGIONAL DE LA ORINOQUIA E.S.E.,Evento,9073033.0,Abril 2024,Evento
EPSS34,CAPITAL SALUD,891855039.0,HOSPITAL REGIONAL DE SOGAMOSO EMPRESA SOCIAL DEL ESTADO,Evento,2881100.0,Abril 2024,Evento
EPSS34,CAPITAL SALUD,891855209.0,E.S.E. HOSPITAL SAN VICENTE DE PAUL DE PAIPA,Evento,1526986.0,Abril 2024,Evento
EPSS34,CAPITAL SALUD,891855438.0,EMPRESA SOCIAL DEL ESTADO HOSPITAL REGIONAL DE DUITAMA,Evento,17253965.0,Abril 2024,Evento
EPSS34,CAPITAL SALUD,891901158.0,E.S.E HOSPITAL DEPARTAMENTAL TOMAS URIBE URIBE DE TULUA EMPRESA SOCIAL DEL ESTADO,Evento,7556390.0,Abril 2024,Evento
EPSS34,CAPITAL SALUD,892000264.0,E.S.E. HOSPITAL MUNICIPAL DE ACACIAS,Evento,18130730.0,Abril 2024,Evento
EPSS34,CAPITAL SALUD,892000401.0,INVERSIONES CLINICA DEL META S.A.,Evento,807725148.0,Abril 2024,Evento
EPSS34,CAPITAL SALUD,892000458.0,EMPRESA SOCIAL DEL ESTADO HOSPITAL LOCAL DE SAN MARTIN DE LOS LLANOS,Evento,25033850.0,Abril 2024,Evento
EPSS34,CAPITAL SALUD,892000501.0,HOSPITAL DEPARTAMENTAL DE VILLAVICENCIO E.S.E.,Evento,2674257022.0,Abril 2024,Evento
EPSS34,CAPITAL SALUD,892115010.0,EMPRESA SOCIAL DEL ESTADO HOSPITAL SAN RAFAEL NIVEL II,Evento,8874619.0,Abril 2024,Evento
EPSS34,CAPITAL SALUD,892120115.0,ESE HOSPITAL SAN JOSE DE MAICAO,Evento,8781055.0,Abril 2024,Evento
EPSS34,CAPITAL SALUD,892280033.0,HOSPITAL UNIVERSITARIO DE SINCELEJO E.S.E,Evento,18618790.0,Abril 2024,Evento
EPSS34,CAPITAL SALUD,892300445.0,ESE HOSPITAL REGIONAL DE AGUACHICA JOSE DAVID PADILLA VILLAFAÑE,Evento,9465876.0,Abril 2024,Evento
EPSS34,CAPITAL SALUD,892399994.0,HOSPITAL ROSARIO PUMAREJO DE LOPEZ - EMPRESA SOCIAL DEL ESTADO,Evento,25489726.0,Abril 2024,Evento
EPSS34,CAPITAL SALUD,899999017.0,SOCIEDAD DE CIRUGIA DE BOGOTA HOSPITAL DE SAN JOSE,Evento,1945326917.0,Abril 2024,Evento
EPSS34,CAPITAL SALUD,899999032.0,EMPRESA SOCIAL DEL ESTADO HOSPITAL UNIVERSITARIO DE LA SAMARITANA,Evento,29520005.0,Abril 2024,Evento
EPSS34,CAPITAL SALUD,899999092.0,INSTITUTO NACIONAL DE CANCEROLOGIA,Evento,13262154988.0,Abril 2024,Evento
EPSS34,CAPITAL SALUD,899999123.0,FUNDACION HOSPITAL DE LA MISERICORDIA,Evento,1662894958.0,Abril 2024,Evento
EPSS34,CAPITAL SALUD,899999147.0,EMPRESA SOCIAL DEL ESTADO HOSPITAL EL SALVADOR DE UBATE,Evento,1312766.0,Abril 2024,Evento
EPSS34,CAPITAL SALUD,899999151.0,E.S.E HOSPITAL SAN RAFAEL DE FACATATIVÁ,Evento,91617318.0,Abril 2024,Evento
EPSS34,CAPITAL SALUD,899999156.0,E.S.E. HOSPITAL SAN ANTONIO CHIA,Evento,1986718.0,Abril 2024,Evento
EPSS34,CAPITAL SALUD,899999163.0,E.S.E. HOSPITAL SAN FRANCISCO DE GACHETA,Evento,2471576.0,Abril 2024,Evento
EPSS34,CAPITAL SALUD,899999165.0,EMPRESA SOCIAL DEL ESTADO HOSPITAL SAN JOSE,Evento,2418334.0,Abril 2024,Evento
EPSS34,CAPITAL SALUD,900004059.0,HOSPITAL DE CASTILLA LA NUEVA EMPRESA SOCIAL DEL ESTADO,Evento,69375082.0,Abril 2024,Evento
EPSS34,CAPITAL SALUD,900004894.0,HOSPITAL REGIONAL SEGUNDO NIVEL DE ATENCIÓN VALLE DE TENZA E.S.E.,Evento,10784575.0,Abril 2024,Evento
EPSS34,CAPITAL SALUD,900006037.0,EMPRESA SOCIAL DEL ESTADO HOSPITAL UNIVERSITARIO DE SANTANDER,Evento,18224887.0,Abril 2024,Evento
EPSS34,CAPITAL SALUD,900033752.0,UNIVER PLUS,Evento,219947549.0,Abril 2024,Evento
EPSS34,CAPITAL SALUD,900034131.0,ESE MORENO Y CLAVIJO,Evento,1412747.0,Abril 2024,Evento
EPSS34,CAPITAL SALUD,900038926.0,PROMOTORA MEDICA Y ODONTOLOGICA DE ANTIOQUIA S.A,Evento,1471306.0,Abril 2024,Evento
EPSS34,CAPITAL SALUD,900067136.0,E.S.E. HOSPITAL REGIONAL DE VELEZ,Evento,4292485.0,Abril 2024,Evento
EPSS34,CAPITAL SALUD,900067169.0,EMPRESA SOCIAL DEL ESTADO HOSPITAL REGIONAL DE GARCIA ROVIRA,Evento,1420433.0,Abril 2024,Evento
EPSS34,CAPITAL SALUD,900073674.0,ATENCION MEDICA DE COLOMBIA SAS,Evento,96123981.0,Abril 2024,Evento
EPSS34,CAPITAL SALUD,900091143.0,EMPRESA SOCIAL DEL ESTADO PASTO SALUD E.S.E.,Evento,1771280.0,Abril 2024,Evento
EPSS34,CAPITAL SALUD,900098476.0,FUNDACION HOSPITAL INFANTIL UNIVERSITARIO DE SAN JOSE,Evento,316233218.0,Abril 2024,Evento
EPSS34,CAPITAL SALUD,900098985.0,ORGANIZACION VIHONCO IPS SAS,Evento,269516100.0,Abril 2024,Evento
EPSS34,CAPITAL SALUD,900118856.0,LLANO SMILE S.A.S,Evento,23917006.0,Abril 2024,Evento
EPSS34,CAPITAL SALUD,900138104.0,CORPOALEGRIA,Evento,56360346.0,Abril 2024,Evento
EPSS34,CAPITAL SALUD,900138555.0,INVERSIONES MEREZ S.A.S,Evento,24363138.0,Abril 2024,Evento
EPSS34,CAPITAL SALUD,900145767.0,ESE SUR OCCIDENTE,Evento,1151146.0,Abril 2024,Evento
EPSS34,CAPITAL SALUD,900146332.0,CLINICENTRO DE REHABILITACION CARDIACA Y PULMONAR LTDA,Evento,28222225.0,Abril 2024,Evento
EPSS34,CAPITAL SALUD,900148265.0,ANGIOGRAFIA DE COLOMBIA S.A.S.,Evento,594905720.0,Abril 2024,Evento
EPSS34,CAPITAL SALUD,900161116.0,SOCIEDAD CARDIOLOGICA COLOMBIANA S.A.S,Evento,24431624.0,Abril 2024,Evento
EPSS34,CAPITAL SALUD,900171211.0,GLOBAL LIFE AMBULANCIAS SAS,Evento,284461475.0,Abril 2024,Evento
EPSS34,CAPITAL SALUD,900177115.0,INVERSIONES LEAL Y OXIGENOS SAS,Evento,465475700.0,Abril 2024,Evento
EPSS34,CAPITAL SALUD,900206215.0,ASISTENCIA CIENTIFICA DE ALTA COMPLEJIDAD SAS,Evento,313800000.0,Abril 2024,Evento
EPSS34,CAPITAL SALUD,900210981.0,CORPORACIÓN HOSPITALARIA JUAN CIUDAD,Evento,65471504.0,Abril 2024,Evento
EPSS34,CAPITAL SALUD,900211460.0,E.S.E. SOR TERESA ADELE,Evento,3039584.0,Abril 2024,Evento
EPSS34,CAPITAL SALUD,900211468.0,E.S.E. FABIO JARAMILLO LONDOÑO,Evento,1637500.0,Abril 2024,Evento
EPSS34,CAPITAL SALUD,900213617.0,CORPORACION CLINICA PRIMAVERA,Evento,67810263.0,Abril 2024,Evento
EPSS34,CAPITAL SALUD,900267940.0,ZERENIA S.A.S.,Evento,53376018.0,Abril 2024,Evento
EPSS34,CAPITAL SALUD,900274166.0,CENTRO DE EXCELENCIA PARA EL MANEJO DE LA DIABETES S.A.S. SIGLA CEMDI SAS,Evento,341453088.0,Abril 2024,Evento
EPSS34,CAPITAL SALUD,900279660.0,PROMOTORA BOCAGRANDE S.A. PROBOCA S.A.,Evento,10918200.0,Abril 2024,Evento
EPSS34,CAPITAL SALUD,900291018.0,CLINICA LOS NOGALES SAS,Evento,1500468.0,Abril 2024,Evento
EPSS34,CAPITAL SALUD,900298928.0,ARTMEDICA S.A.S,Evento,461988142.0,Abril 2024,Evento
EPSS34,CAPITAL SALUD,900307370.0,IPS ORTOFISICA DE COLOMBIA SAS,Evento,25823500.0,Abril 2024,Evento
EPSS34,CAPITAL SALUD,900310945.0,DOMSALUD DEL META S.A.S,Evento,105869100.0,Abril 2024,Evento
EPSS34,CAPITAL SALUD,900338671.0,IPS OXI CARE S.A.S,Evento,159497049.0,Abril 2024,Evento
EPSS34,CAPITAL SALUD,900364721.0,UNIDAD MEDICA ONCOLOGICA ONCOLIFE IPS SAS,Evento,2525927123.0,Abril 2024,Evento
EPSS34,CAPITAL SALUD,900385628.0,MEDICENTRO FAMILIAR IPS SAS,Evento,38817548.0,Abril 2024,Evento
EPSS34,CAPITAL SALUD,900407111.0,GENCELL PHARMA S.A.S,Evento,93502377.0,Abril 2024,Evento
EPSS34,CAPITAL SALUD,900413988.0,NP MEDICAL IPS SAS,Evento,362013922.0,Abril 2024,Evento
EPSS34,CAPITAL SALUD,900415872.0,GRUPO EMPRESARIAL FUERZA LIDER SAS,Evento,18469450.0,Abril 2024,Evento
EPSS34,CAPITAL SALUD,900424844.0,CCICOL S.A.S,Evento,55239750.0,Abril 2024,Evento
EPSS34,CAPITAL SALUD,900448559.0,MEDIGLOBAL IPS SAS,Evento,9615000.0,Abril 2024,Evento
EPSS34,CAPITAL SALUD,900468665.0,VIDAMEDICAL BOGOTA IPS SAS,Evento,149525000.0,Abril 2024,Evento
EPSS34,CAPITAL SALUD,900470909.0,NUEVA CLÍNICA EL BARZAL S.A.S,Evento,160971202.0,Abril 2024,Evento
EPSS34,CAPITAL SALUD,900496641.0,CLINICOS PROGRAMAS DE ATENCIÓN INTEGRAL S.A.S IPS,Evento,289577608.0,Abril 2024,Evento
EPSS34,CAPITAL SALUD,900518251.0,S.A.E. SERVICIOS AEREOS ESPECIALES GLOBAL LIFE AMBULANCIAS S.A.S,Evento,17750000.0,Abril 2024,Evento
EPSS34,CAPITAL SALUD,900529056.0,MEDIFACA IPS S.A.S,Evento,5999429.0,Abril 2024,Evento
EPSS34,CAPITAL SALUD,900532504.0,DAVITA S.A.S.,Evento,324708013.0,Abril 2024,Evento
EPSS34,CAPITAL SALUD,900543651.0,COMPAÑÍA CALIDAD Y CUIDADO EN SALUD SAS - COMPCASA SAS,Evento,26700000.0,Abril 2024,Evento
EPSS34,CAPITAL SALUD,900578105.0,CORPORACIÓN SALUD UN,Evento,5596020.0,Abril 2024,Evento
EPSS34,CAPITAL SALUD,900601075.0,I S H INTEGRAL SOLUTIONS IN HEALTH SAS,Evento,31209200.0,Abril 2024,Evento
EPSS34,CAPITAL SALUD,900622320.0,GASTROKIDS SAS,Evento,44701250.0,Abril 2024,Evento
EPSS34,CAPITAL SALUD,900641654.0,TERAMED SAS,Evento,828423603.0,Abril 2024,Evento
EPSS34,CAPITAL SALUD,900807482.0,EMPRESA SOCIAL DEL ESTADO HOSPITAL DE LA VEGA,Evento,3878509.0,Abril 2024,Evento
EPSS34,CAPITAL SALUD,900829069.0,GRUPO EMPRESARIAL JARBSALUD IPS SAS,Evento,1388741.0,Abril 2024,Evento
EPSS34,CAPITAL SALUD,900838988.0,AIR LIQUIDE COLOMBIA SAS,Evento,255345103.0,Abril 2024,Evento
EPSS34,CAPITAL SALUD,900856982.0,AUNARSALUD SERVICIOS INTEGRALES EN SALUD SAS - SIGLA AUNARSALUD,Evento,639723789.0,Abril 2024,Evento
EPSS34,CAPITAL SALUD,900900122.0,HEALTH & LIFE IPS SAS SIGLA H&L UCC SAS,Evento,382772033.0,Abril 2024,Evento
EPSS34,CAPITAL SALUD,900958564.0,SUBRED INTEGRADA DE SERVICIOS DE SALUD SUR E.S.E.,Evento,10843177613.0,Abril 2024,Evento
EPSS34,CAPITAL SALUD,900959048.0,SUBRED INTEGRADA DE SERVICIOS DE SALUD SUR OCCIDENTE E.S.E,Evento,9070442670.0,Abril 2024,Evento
EPSS34,CAPITAL SALUD,900959051.0,SUBRED INTEGRADA DE SERVICIOS DE SALUD CENTRO ORIENTE E.S.E,Evento,9414692825.0,Abril 2024,Evento
EPSS34,CAPITAL SALUD,900963716.0,IPS CMT SOLUCIONES MEDICAS SAS,Evento,320316349.0,Abril 2024,Evento
EPSS34,CAPITAL SALUD,900971006.0,SUBRED INTEGRADA DE SERVICIOS DE SALUD NORTE E.S.E,Evento,8534635685.0,Abril 2024,Evento
EPSS34,CAPITAL SALUD,901119103.0,NEUROELECTRODIAGNOSTICO SH DEL LLANO SAS,Evento,62066125.0,Abril 2024,Evento
EPSS34,CAPITAL SALUD,901164974.0,JUNICAL MEDICAL S.A.S.,Evento,4785388.0,Abril 2024,Evento
EPSS34,CAPITAL SALUD,901201887.0,HOSPITAL DE ALTA COMPLEJIDAD DEL PUTUMAYO S.A.S ZOMAC,Evento,17112273.0,Abril 2024,Evento
EPSS34,CAPITAL SALUD,901294078.0,TRANSPORTES ESPECIALES DESPEGAR SAS,Evento,88206000.0,Abril 2024,Evento
EPSS34,CAPITAL SALUD,901326019.0,CLINICA DE URGENCIAS DE SALUD MENTAL SAN LUCAS SAS,Evento,20346050.0,Abril 2024,Evento
EPSS34,CAPITAL SALUD,901403593.0,SAMEN IPS SAS,Evento,2887028.0,Abril 2024,Evento
EPSS34,CAPITAL SALUD,901449734.0,SERVICIOS MÉDICOS ESPECIALIZADOS NEUROSALUD SAS NEUROSALUD I.S.P. S.A.S,Evento,17042100.0,Abril 2024,Evento
EPSS34,CAPITAL SALUD,901532463.0,HOSPITAL DE ALTA COMPLEJIDAD DEL MAGDALENA CENTRO S.A.S,Evento,49652272.0,Abril 2024,Evento
EPSS34,CAPITAL SALUD,901536799.0,EMPRESA SOCIAL DEL ESTADO UNIVERSITARIA DEL ATLANTICO,Evento,19625768.0,Abril 2024,Evento
EPSS40,SAVIA SALUD,800000118.0,EMPRESA SOCIAL DEL ESTADO HOSPITAL DEPARTAMENTAL UNIVERSITARIO DEL QUINDIO SAN JUAN DE DIOS,Evento,11656261.0,Abril 2024,Evento
EPSS40,SAVIA SALUD,800006850.0,EMPRESA SOCIAL DEL ESTADO REGION DE SALUD SOACHA,Evento,5454029.0,Abril 2024,Evento
EPSS40,SAVIA SALUD,800014405.0,ESE HOSPITAL SANTA ISABEL,Evento,5688185.0,Abril 2024,Evento
EPSS40,SAVIA SALUD,800014884.0,ESE HOSPITAL HÉCTOR ABAD GÓMEZ,Evento,35949574.0,Abril 2024,Evento
EPSS40,SAVIA SALUD,800014918.0,E.S.E. HOSPITAL UNIVERSITARIO ERASMO MEOZ,Evento,22174986.0,Abril 2024,Evento
EPSS40,SAVIA SALUD,800037021.0,HOSPITAL DEPARTAMENTAL DE GRANADA - EMPRESA SOCIAL DEL META,Evento,11156126.0,Abril 2024,Evento
EPSS40,SAVIA SALUD,800037244.0,E.S.E. HOSPITAL GUILLERMO GAVIRIA CORREA,Evento,8994921.0,Abril 2024,Evento
EPSS40,SAVIA SALUD,800038024.0,UNIDAD CLINICA LA MAGDALENA SAS,Evento,22789519.0,Abril 2024,Evento
EPSS40,SAVIA SALUD,800044402.0,INVERSIONES MEDICAS DE ANTIOQUIA S.A. CLINICA LAS VEGAS,Evento,13941196.0,Abril 2024,Evento
EPSS40,SAVIA SALUD,800044967.0,ASSBASALUD ESE,Evento,1435603.0,Abril 2024,Evento
EPSS40,SAVIA SALUD,800058016.0,EMPRESA SOCIAL DEL ESTADO METROSALUD,Evento,3500889085.0,Abril 2024,Evento
EPSS40,SAVIA SALUD,800058856.0,CLINICA DE URABA SA,Evento,200981090.0,Abril 2024,Evento
EPSS40,SAVIA SALUD,800067065.0,PROMOTORA MEDICA LAS AMERICAS S.A,Evento,208872146.0,Abril 2024,Evento
