EPSS10,EPS SURA,804002599.0,CENTRO DE ATENCION Y DIAGNOSTICO DE ENFERMEDADES INFECCIOSAS C.D.I.S.A.S.,Evento,3171185.0,Abril 2024,Evento
EPSS10,EPS SURA,804005555.0,E.S.E. HOSPITAL SANTO DOMINGO SAVIO,Evento,1185168.0,Abril 2024,Evento
EPSS10,EPS SURA,804006167.0,AUDIOMIC S.A.S,Evento,9561070.0,Abril 2024,Evento
EPSS10,EPS SURA,804006936.0,ESE CLINICA GUANE Y SU RED INTEGRAL DE SALUD,Evento,1255234.0,Abril 2024,Evento
EPSS10,EPS SURA,804010334.0,MEDIIMPLANTES S.A,Evento,11829961.0,Abril 2024,Evento
EPSS10,EPS SURA,804011481.0,VIVASALUD I.P.S. S.A.S,Evento,13803428.0,Abril 2024,Evento
EPSS10,EPS SURA,804014839.0,INSTITUTO DEL CORAZÓN DE BUCARAMANGA S.A.,Evento,13785207.0,Abril 2024,Evento
EPSS10,EPS SURA,804014898.0,CAL ONCOLOGICOS LTDA,Evento,100317571.0,Abril 2024,Evento
EPSS10,EPS SURA,805010659.0,AMANECER MEDICO SAS,Evento,24162382.0,Abril 2024,Evento
EPSS10,EPS SURA,805011262.0,RTS S.A.S,Evento,286451198.0,Abril 2024,Evento
EPSS10,EPS SURA,805016006.0,AMIGOS DE LA SALUD AMISALUD SAS,Evento,1852070.0,Abril 2024,Evento
EPSS10,EPS SURA,805017681.0,GAMANUCLEAR LTDA,Evento,7492828.0,Abril 2024,Evento
EPSS10,EPS SURA,805023423.0,SOCIEDAD N.S.D.R. S.A.S,Evento,40933938.0,Abril 2024,Evento
EPSS10,EPS SURA,805025043.0,GASTROENTEROLOGOS ASOCIADOS S.A.S.,Evento,7411030.0,Abril 2024,Evento
EPSS10,EPS SURA,805027289.0,E.S.E. RED DE SALUD DE LADERA EMPRESA SOCIAL DEL ESTADO HOSPITAL CAÑAVERALEJO,Evento,1001941.0,Abril 2024,Evento
EPSS10,EPS SURA,805027337.0,RED DE SALUD DEL ORIENTE EMPRESA SOCIAL DEL ESTADO E.S.E,Evento,1028600.0,Abril 2024,Evento
EPSS10,EPS SURA,805027338.0,E.S.E. HOSPITAL CARLOS CARMONA MONTOYA IPS,Evento,1315267.0,Abril 2024,Evento
EPSS10,EPS SURA,805027743.0,DUMIAN MÉDICAL S.A.S,Evento,37865524.0,Abril 2024,Evento
EPSS10,EPS SURA,806001061.0,EMPRESA SOCIAL DEL ESTADO CLINICA MATERNIDAD RAFAEL CALVO,Evento,38458001.0,Abril 2024,Evento
EPSS10,EPS SURA,806003489.0,UNIDAD CARDIOLOGICA DE CARTAGENA LTDA,Evento,7468292.0,Abril 2024,Evento
EPSS10,EPS SURA,806005602.0,ESE HOSPITAL LOCAL TURBACO,Evento,3787900.0,Abril 2024,Evento
EPSS10,EPS SURA,806006237.0,SOCIEDAD DE CANCEROLOGIA DE LA COSTA S.A.S.,Evento,9520509.0,Abril 2024,Evento
EPSS10,EPS SURA,806007650.0,CENTRO RADIO-ONCOLOGICO DEL CARIBE S.A.S.,Evento,72229142.0,Abril 2024,Evento
EPSS10,EPS SURA,806007923.0,E.S.E. HOSPITAL LOCAL ARJONA,Evento,2881083.0,Abril 2024,Evento
EPSS10,EPS SURA,806008356.0,UCI DEL CARIBE SAS,Evento,30587285.0,Abril 2024,Evento
EPSS10,EPS SURA,806008439.0,CLINICA CARTAGENA DEL MAR S.A.S,Evento,53547023.0,Abril 2024,Evento
EPSS10,EPS SURA,806009230.0,CEMIC SAS,Evento,25571185.0,Abril 2024,Evento
EPSS10,EPS SURA,806010305.0,ESE HOSPITAL LOCAL CARTAGENA DE INDIAS,Evento,8011675.0,Abril 2024,Evento
EPSS10,EPS SURA,806013287.0,SERVICIOS FONOAUDIOLOGICOS DEL CARIBE S.A.S,Evento,3461765.0,Abril 2024,Evento
EPSS10,EPS SURA,806013568.0,NEURODINAMIA S.A,Evento,138999200.0,Abril 2024,Evento
EPSS10,EPS SURA,806013944.0,IMÁGENES Y RADIOLOGIA S.A.S.,Evento,28043880.0,Abril 2024,Evento
EPSS10,EPS SURA,806015201.0,GESTION SALUD S.A.S.,Evento,12819843.0,Abril 2024,Evento
EPSS10,EPS SURA,806016870.0,UNIDAD DE PATOLOGIA CLINICA S.A.S.,Evento,1556803.0,Abril 2024,Evento
EPSS10,EPS SURA,809003590.0,UNIDAD DE SALUD DE IBAGUE EMPRESA SOCIAL DEL ESTADO,Evento,3137835.0,Abril 2024,Evento
EPSS10,EPS SURA,810000423.0,FUNDACION PEQUEÑO CORAZON,Evento,6213674.0,Abril 2024,Evento
EPSS10,EPS SURA,810000913.0,EMPRESA SOCIAL DEL ESTADO HOSPITAL SAN FELIX LA DORADA CALDAS,Evento,7052159.0,Abril 2024,Evento
EPSS10,EPS SURA,810001159.0,ESE HOSPITAL DEPARTAMENTAL SAN JOSE DE SAN JOSE,Evento,1180625.0,Abril 2024,Evento
EPSS10,EPS SURA,810002335.0,CENTRO DE DIAGNOSTICO UROLOGICO S.A C.D.U.S.A,Evento,26220350.0,Abril 2024,Evento
EPSS10,EPS SURA,810002689.0,MYCAR IPS SAS,Evento,2205150.0,Abril 2024,Evento
EPSS10,EPS SURA,810003245.0,CLÍNICA OSPEDALE MANIZALES S.A,Evento,46157047.0,Abril 2024,Evento
EPSS10,EPS SURA,811000136.0,COOPERATIVA DE SALUD SAN ESTEBAN,Evento,6648578.0,Abril 2024,Evento
EPSS10,EPS SURA,811002429.0,CLINICA PAJONAL S.A.S,Evento,20659366.0,Abril 2024,Evento
EPSS10,EPS SURA,811004569.0,ANGIOLOGIA MEDICA DIAGNOSTICA SAS,Evento,8958314.0,Abril 2024,Evento
EPSS10,EPS SURA,811004956.0,FUNDACIÓN LA LUZ - CENTRO NACIONAL PARA EL TRATAMIENTO DE LA DROGADICCIÓN,Evento,57162050.0,Abril 2024,Evento
EPSS10,EPS SURA,811007144.0,CEDIMED S.A.S,Evento,80786178.0,Abril 2024,Evento
EPSS10,EPS SURA,811007558.0,UNIDAD DE OSTEOPOROSIS S.A.S,Evento,7942832.0,Abril 2024,Evento
EPSS10,EPS SURA,811007832.0,SERVICIOS DE SALUD IPS SURAMERICANA S.A.S,Evento,1288538126.0,Abril 2024,Evento
EPSS10,EPS SURA,811013645.0,OXISALUD S.A.S,Evento,43591275.0,Abril 2024,Evento
EPSS10,EPS SURA,811016192.0,HOSPITAL ALMA MÁTER DE ANTIOQUIA,Evento,7132142.0,Abril 2024,Evento
EPSS10,EPS SURA,811017810.0,E.S.E. HOSPITAL DEL SUR GABRIEL JARAMILLO PIEDRAHITA,Evento,4388393.0,Abril 2024,Evento
EPSS10,EPS SURA,811021843.0,MEDICAUCA S.A.S,Evento,2451624.0,Abril 2024,Evento
EPSS10,EPS SURA,811022474.0,R.P DENTAL S.A,Evento,70984599.0,Abril 2024,Evento
EPSS10,EPS SURA,811032818.0,SALUD TREC S.A.S,Evento,25525277.0,Abril 2024,Evento
EPSS10,EPS SURA,811032919.0,INDUSTRIAS MEDICAS SAMPEDRO S.A.S,Evento,87437017.0,Abril 2024,Evento
EPSS10,EPS SURA,811035201.0,CORPORACION SEMILLAS DE FE COMUNIDAD TERAPEUTICA CENTRO DE ATENCION EN DROGODEPENDENCIAS IPS,Evento,4860428.0,Abril 2024,Evento
EPSS10,EPS SURA,811038804.0,OFTALMOSERVICIOS IPS S.A.S.,Evento,179135342.0,Abril 2024,Evento
EPSS10,EPS SURA,811040023.0,ELECTROMIOGRAFIA DE ALTA TECNOLOGIA S.A.S,Evento,7011153.0,Abril 2024,Evento
EPSS10,EPS SURA,811041784.0,SUPLEMEDICOS S.A.S,Evento,205061638.0,Abril 2024,Evento
EPSS10,EPS SURA,811042050.0,SERVIUCIS S.A.S.,Evento,51541529.0,Abril 2024,Evento
EPSS10,EPS SURA,811042064.0,CENTRO CARDIOVASCULAR SOMER INCARE S A,Evento,200147253.0,Abril 2024,Evento
EPSS10,EPS SURA,811043887.0,FUNDACIÒN LUPINES,Evento,11863800.0,Abril 2024,Evento
EPSS10,EPS SURA,811046900.0,CLINICA CARDIO VID,Evento,1286937319.0,Abril 2024,Evento
EPSS10,EPS SURA,812000300.0,ESE HOSPITAL SAGRADO CORAZON DE JESUS,Evento,7141450.0,Abril 2024,Evento
EPSS10,EPS SURA,812000527.0,CLINICA SAHAGUN I.P.S. S.A,Evento,2477237.0,Abril 2024,Evento
EPSS10,EPS SURA,812001219.0,E.S.E HOSPITAL SAN JORGE,Evento,3097345.0,Abril 2024,Evento
EPSS10,EPS SURA,812002958.0,CLINICA LA TRINIDAD I.P.S. LTDA,Evento,22658505.0,Abril 2024,Evento
EPSS10,EPS SURA,812002993.0,E.S.E CAMU IRIS LÓPEZ DURAN,Evento,1406397.0,Abril 2024,Evento
EPSS10,EPS SURA,812003455.0,EMPRESA SOCIAL DEL ESTADO CAMU MOÑITOS,Evento,1002844.0,Abril 2024,Evento
EPSS10,EPS SURA,812003726.0,E.S.E. CENTRO DE SALUD DE COTORRA,Evento,1129660.0,Abril 2024,Evento
EPSS10,EPS SURA,812003851.0,ESE HOSPITAL SAN JUAN DE SAHAGUN,Evento,6650468.0,Abril 2024,Evento
EPSS10,EPS SURA,812004935.0,CLINICA MATERNO INFANTIL CASA DEL NIÑO S.A.S,Evento,22809208.0,Abril 2024,Evento
EPSS10,EPS SURA,812005130.0,ESPECIALISTAS ASOCIADOS S.A.,Evento,4555036.0,Abril 2024,Evento
EPSS10,EPS SURA,812005323.0,TERAPIAS INTEGRALES S.A.S.,Evento,2724000.0,Abril 2024,Evento
EPSS10,EPS SURA,812005522.0,FUNDACION AMIGOS DE LA SALUD,Evento,27167399.0,Abril 2024,Evento
EPSS10,EPS SURA,812005644.0,CLINICA REGIONAL DEL SAN JORGE AGENCIA YOPAL,Evento,2549691.0,Abril 2024,Evento
EPSS10,EPS SURA,812005726.0,EMPRESA SOCIAL DEL ESTADO VIDASINU,Evento,6022900.0,Abril 2024,Evento
EPSS10,EPS SURA,812007194.0,ONCOMEDICA S.A.S,Evento,50664089.0,Abril 2024,Evento
EPSS10,EPS SURA,812007286.0,CLÍNICA LAURELES PSIQUIATRAS ASOCIADOS. I.P.S S.A.S.,Evento,3321966.0,Abril 2024,Evento
EPSS10,EPS SURA,813001952.0,CLINICA MEDILASER S.A.S.,Evento,5340004.0,Abril 2024,Evento
EPSS10,EPS SURA,813002940.0,EMPRESA SOCIAL DEL ESTADO MARIA AUXILIADORA DE GARZON,Evento,1140441.0,Abril 2024,Evento
EPSS10,EPS SURA,813011465.0,ESE HOSPITAL LUIS ANTONIO MOJICA,Evento,1870771.0,Abril 2024,Evento
EPSS10,EPS SURA,813011577.0,CLINICA UROS S.A.S - TORRE A,Evento,48568917.0,Abril 2024,Evento
EPSS10,EPS SURA,815000253.0,IPS CLINICA SALUD FLORIDA S.A,Evento,3778858.0,Abril 2024,Evento
EPSS10,EPS SURA,815000316.0,E.S.E. HOSPITAL RAUL OREJUELA BUENO,Evento,10895491.0,Abril 2024,Evento
EPSS10,EPS SURA,816000810.0,UNIDAD OFTALMOLOGICA LASER S.A,Evento,86661997.0,Abril 2024,Evento
EPSS10,EPS SURA,816002451.0,CALCULASER S.A.,Evento,95453909.0,Abril 2024,Evento
EPSS10,EPS SURA,816005003.0,EMPRESA SOCIAL DEL ESTADO SALUD PEREIRA,Evento,22140787.0,Abril 2024,Evento
EPSS10,EPS SURA,817003166.0,CLÍNICA LA ESTANCIA S. A.,Evento,48742138.0,Abril 2024,Evento
EPSS10,EPS SURA,818000466.0,ESE HOSPITAL SAN JOSE DE TADO,Evento,7660807.0,Abril 2024,Evento
EPSS10,EPS SURA,818002571.0,CENTRO MEDICO CUBIS LIMITADA,Evento,2245871.0,Abril 2024,Evento
EPSS10,EPS SURA,819000364.0,CLINICA DE LA MUJER S.A.,Evento,15065808.0,Abril 2024,Evento
EPSS10,EPS SURA,819001352.0,ESE HOSPITAL LOCAL DE SALAMINA,Evento,1418596.0,Abril 2024,Evento
EPSS10,EPS SURA,819001483.0,EMPRESA SOCIAL DEL ESTADO HOSPITAL FRAY LUIS DE LEON,Evento,1368781.0,Abril 2024,Evento
EPSS10,EPS SURA,819002025.0,E.S.E HOSPITAL SANTANDER HERRERA DE PIVIJAY,Evento,4240563.0,Abril 2024,Evento
EPSS10,EPS SURA,819002176.0,COMPAÑÍA COLOMBIANA DE SALUD COLSALUD S.A,Evento,37894305.0,Abril 2024,Evento
EPSS10,EPS SURA,819003863.0,PREVENCION Y SALUD INTEGRAL PARA LA FAMILIA IPS LTDA,Evento,2183212.0,Abril 2024,Evento
EPSS10,EPS SURA,819004070.0,ESE ALEJANDRO PROSPERO REVEREND,Evento,7751700.0,Abril 2024,Evento
EPSS10,EPS SURA,819006193.0,INSTITUTO NEUROPSIQUIATRICO NUESTRA SEÑORA DEL CARMEN INSECAR,Evento,10476497.0,Abril 2024,Evento
EPSS10,EPS SURA,820002916.0,EMPRESA SOCIAL DEL ESTADO CENTRO DE SALUD EDGAR ALONSO PULIDO SOLANO,Evento,1520626.0,Abril 2024,Evento
EPSS10,EPS SURA,820003850.0,EMPRESA SOCIAL DEL ESTADO SANTIAGO DE TUNJA,Evento,3984883.0,Abril 2024,Evento
EPSS10,EPS SURA,821003143.0,E.S.E. HOSPITAL DEPARTAMENTAL CENTENARIO DE SEVILLA EMPRESA SOCIAL DEL ESTADO (SEDE 0001),Evento,8245898.0,Abril 2024,Evento
EPSS10,EPS SURA,823004881.0,I.P.S. CLINICA GUARANDA SANA S.A.S.,Evento,3002208.0,Abril 2024,Evento
EPSS10,EPS SURA,824000450.0,HOSPITAL SAN JUAN BOSCO E.S.E,Evento,2148352.0,Abril 2024,Evento
EPSS10,EPS SURA,824000725.0,EMPRESA SOCIAL DEL ESTADO HOSPITAL EDUARDO ARREDONDO DAZA,Evento,1523241.0,Abril 2024,Evento
EPSS10,EPS SURA,824001041.0,CLINICA MEDICOS S.A.,Evento,28770418.0,Abril 2024,Evento
EPSS10,EPS SURA,824003334.0,FUNDACION INTERNACIONAL PARA EL DESARROLLO DE LAS COMUNIDADES FIDEC,Evento,1524600.0,Abril 2024,Evento
EPSS10,EPS SURA,829001256.0,ESE HOSPITAL MANUEL ELKIN PATARROYO,Evento,1728826.0,Abril 2024,Evento
EPSS10,EPS SURA,830007355.0,FRESENIUS MEDICAL CARE COLOMBIA S.A.,Evento,448301697.0,Abril 2024,Evento
EPSS10,EPS SURA,830018305.0,FUNDACIÓN JAVERIANA DE SERVICIOS MEDICO ODONTOLOGICOS INTERUNIVERSITARIOS CARLOS MARQUEZ VILLEGAS-JAVESALUD,Evento,470367.0,Abril 2024,Evento
EPSS10,EPS SURA,830025149.0,METRONIC COLOMBIA SAS,Evento,51293088.0,Abril 2024,Evento
EPSS10,EPS SURA,830027158.0,RIESGO DE FRACTURA S.A. CAYRE,Evento,5326302.0,Abril 2024,Evento
EPSS10,EPS SURA,830058292.0,UROBOSQUE S.A,Evento,45211128.0,Abril 2024,Evento
EPSS10,EPS SURA,830066626.0,MEDIHELP SERVICES COLOMBIA,Evento,67687531.0,Abril 2024,Evento
EPSS10,EPS SURA,830070284.0,RESONANCIA MAGNETICA DEL COUNTRY SAS,Evento,9153789.0,Abril 2024,Evento
EPSS10,EPS SURA,830071938.0,SOCIEDAD PEDIATRICA DE LOS ANDES S.A.S - SPLA S.A.S.,Evento,17490347.0,Abril 2024,Evento
EPSS10,EPS SURA,830090073.0,ASOCIACION DE AMIGOS CONTRA EL CANCER PROSEGUIR,Evento,11585328.0,Abril 2024,Evento
EPSS10,EPS SURA,830102932.0,CENTRO OCULAR DE MIOPIA DR RINCON SOCIEDAD POR ACCIONES SIMPLIFICADA SAS,Evento,61449225.0,Abril 2024,Evento
EPSS10,EPS SURA,830104627.0,HOSPITAL CARDIOVASCULAR DE CUNDINAMARCA S.A,Evento,10031006.0,Abril 2024,Evento
EPSS10,EPS SURA,830113849.0,CLINICA JUAN N CORPAS LTDA.,Evento,27255851.0,Abril 2024,Evento
EPSS10,EPS SURA,830120157.0,COLOMBIANA DE TRASPLANTES SAS,Evento,19039528.0,Abril 2024,Evento
EPSS10,EPS SURA,830502282.0,ORTHOPRAXIS S.A.S.,Evento,61077466.0,Abril 2024,Evento
EPSS10,EPS SURA,830507718.0,CLINICA MEDICAL SAS,Evento,16713108.0,Abril 2024,Evento
EPSS10,EPS SURA,830510991.0,CLÍNICA ESPECIALIZADA LA CONCEPCIÓN S.A.S,Evento,9982527.0,Abril 2024,Evento
EPSS10,EPS SURA,830512116.0,UNIDAD DE HEMODINAMIA DEL CAFE SA,Evento,89923802.0,Abril 2024,Evento
EPSS10,EPS SURA,830512886.0,DENTISTETIC S.A.S,Evento,1785874.0,Abril 2024,Evento
EPSS10,EPS SURA,830514240.0,DIAGNOSTIMED S.A.,Evento,79095183.0,Abril 2024,Evento
EPSS10,EPS SURA,832003167.0,CLÍNICA UNIVERSIDAD DE LA SABANA,Evento,209664655.0,Abril 2024,Evento
EPSS10,EPS SURA,832010436.0,HOSPITAL MARIA AUXILIADORA EMPRESA SOCIAL DEL ESTADO DEL MUNICIPIO DE MOSQUERA,Evento,8659537.0,Abril 2024,Evento
EPSS10,EPS SURA,836000386.0,I.P.S. DEL MUNICIPIO DE CARTAGO EMPRESA SOCIAL DEL ESTADO,Evento,1952955.0,Abril 2024,Evento
EPSS10,EPS SURA,839000356.0,SOCIEDAD MEDICA CLINICA MAICAO S.A,Evento,10387632.0,Abril 2024,Evento
EPSS10,EPS SURA,846000471.0,ESE HOSPITAL SAGRADO CORAZON DE JESUS,Evento,7820499.0,Abril 2024,Evento
EPSS10,EPS SURA,860005114.0,MESSER COLOMBIA S.A.,Evento,362625315.0,Abril 2024,Evento
EPSS10,EPS SURA,860006656.0,FUNDACION ABOOD SHAIO,Evento,4779753.0,Abril 2024,Evento
EPSS10,EPS SURA,860006745.0,CONGREGACION DE LAS HERMANAS DE LA CARIDAD DOMINICAS DE LA PRESENTACION DE LA SANTISIMA VIRGEN,Evento,474430209.0,Abril 2024,Evento
EPSS10,EPS SURA,860007336.0,CAJA COLOMBIANA DE SUBSIDIO FAMILIAR COLSUBSIDIO,Evento,2749871206.0,Abril 2024,Evento
EPSS10,EPS SURA,860009555.0,E.S.E. HOSPITAL SANTA MATILDE DE MADRID,Evento,2054432.0,Abril 2024,Evento
EPSS10,EPS SURA,860010783.0,CONGREGACION DE DOMINICAS DE SANTA CATALINA DE SENA,Evento,18181788.0,Abril 2024,Evento
EPSS10,EPS SURA,860013704.0,GASES INDUSTRIALES DE COLOMBIA S.A.,Evento,1083456.0,Abril 2024,Evento
EPSS10,EPS SURA,860013779.0,ASOCIACIÓN PROFAMILIA,Evento,252517661.0,Abril 2024,Evento
EPSS10,EPS SURA,860013874.0,INSTITUTO ROOSEVELT,Evento,83705027.0,Abril 2024,Evento
EPSS10,EPS SURA,860015536.0,HOSPITAL UNIVERSITARIO SAN IGNACIO,Evento,27907536.0,Abril 2024,Evento
EPSS10,EPS SURA,860015888.0,HOSPITAL UNIVERSITARIO CLINICA SAN RAFAEL,Evento,264237829.0,Abril 2024,Evento
EPSS10,EPS SURA,860015905.0,CLINICA NUESTRA SEÑORA DE LA PAZ,Evento,28432728.0,Abril 2024,Evento
EPSS10,EPS SURA,860015929.0,E.S.E. HOSPITAL SALAZAR VILLETA,Evento,1133349.0,Abril 2024,Evento
EPSS10,EPS SURA,860020283.0,E.S.E. HOSPITAL SAN JOSE DE GUADUAS,Evento,1608050.0,Abril 2024,Evento
EPSS10,EPS SURA,860023878.0,EMPRESA SOCIAL DEL ESTADO HOSPITAL DIVINO SALVADOR DE SOPO,Evento,2180204.0,Abril 2024,Evento
EPSS10,EPS SURA,860024026.0,ESE HOSPITAL SAN VICENTE DE PAUL DE NEMOCON,Evento,8571555.0,Abril 2024,Evento
EPSS10,EPS SURA,860024766.0,EMPRESA SOCIAL DEL ESTADO REGION DE SALUD CENTRO ORIENTE ALMEIDAS,Evento,1135458.0,Abril 2024,Evento
EPSS10,EPS SURA,860028947.0,CONGREGACIÓN DE HERMANAS FRANCISCANAS MISIONERAS DE MARÍA AUXILIADORA REGIÓN MISIONERA SANTA MARÍA BERNARDA.,Evento,200825806.0,Abril 2024,Evento
EPSS10,EPS SURA,860035992.0,FUNDACION CARDIO INFANTIL INSTITUTO DE CARDIOLOGIA,Evento,212664875.0,Abril 2024,Evento
EPSS10,EPS SURA,860037950.0,FUNDACION SANTA FE DE BOGOTA,Evento,2606546.0,Abril 2024,Evento
EPSS10,EPS SURA,860039726.0,PARAMEDICOS S.A,Evento,9889372.0,Abril 2024,Evento
EPSS10,EPS SURA,860040094.0,OXIGENOS DE COLOMBIA LTDA,Evento,39062854.0,Abril 2024,Evento
EPSS10,EPS SURA,860053761.0,CLINICA DE OJOS (CLINOJOS) S.A. / CLINOJOS S.A.,Evento,27021771.0,Abril 2024,Evento
EPSS10,EPS SURA,860070301.0,CRUZ ROJA COLOMBIANA SECCIONAL CUNDINAMARCA Y BOGOTA,Evento,2028360.0,Abril 2024,Evento
EPSS10,EPS SURA,860090566.0,CLINICA DEL OCCIDENTE S.A.,Evento,9149209.0,Abril 2024,Evento
EPSS10,EPS SURA,860529890.0,DISORTHO SA,Evento,41618452.0,Abril 2024,Evento
EPSS10,EPS SURA,890000600.0,EMPRESA SOCIAL DEL ESTADO HOSPITAL LA MISERICORDIA IPS,Evento,4336133.0,Abril 2024,Evento
EPSS10,EPS SURA,890000671.0,ESE HOSPITAL SAN VICENTE DE PAUL,Evento,1671609.0,Abril 2024,Evento
EPSS10,EPS SURA,890000905.0,EMPRESA SOCIAL DEL ESTADO HOSPITAL PIO X DEL MUNICIPIO DE LA TEBAIDA QUINDIO,Evento,2393083.0,Abril 2024,Evento
EPSS10,EPS SURA,890000992.0,EMPRESA SOCIAL DEL ESTADO HOSPITAL MENTAL DE FILANDIA,Evento,13232834.0,Abril 2024,Evento
EPSS10,EPS SURA,890001098.0,EMPRESA SOCIAL DEL ESTADO HOSPITAL SAN VICENTE DE PAUL FILANDIA,Evento,6720088.0,Abril 2024,Evento
EPSS10,EPS SURA,890001266.0,LIGA CONTRA EL CANCER DEL QUINDIO QUINDICANCER,Evento,1707288.0,Abril 2024,Evento
EPSS10,EPS SURA,890100275.0,CLINICA DEL CARIBE S.A.,Evento,274859423.0,Abril 2024,Evento
EPSS10,EPS SURA,890102140.0,CLINICA LA ASUNCION,Evento,307167845.0,Abril 2024,Evento
EPSS10,EPS SURA,890102768.0,ORGANIZACION CLINICA GENERAL DEL NORTE S.A.S.,Evento,491007764.0,Abril 2024,Evento
EPSS10,EPS SURA,890102992.0,INSTITUTO DE REHABILITACION ISSA ABUCHAIBE LTDA.,Evento,28356196.0,Abril 2024,Evento
EPSS10,EPS SURA,890103002.0,EMPRESA SOCIAL DEL ESTADO HOSPITAL DE BARANOA,Evento,1200770.0,Abril 2024,Evento
EPSS10,EPS SURA,890103406.0,ESE HOSPITAL DE PUERTO COLOMBIA,Evento,7082930.0,Abril 2024,Evento
EPSS10,EPS SURA,890109666.0,RADIOLOGOS ASOCIADOS S.A.S.,Evento,23939104.0,Abril 2024,Evento
EPSS10,EPS SURA,890110705.0,CLINICA DE FRACTURAS CENTRO DE ORTOPEDIA Y TRAUMATOLOGIA S.A,Evento,2628948.0,Abril 2024,Evento
EPSS10,EPS SURA,890112801.0,FUNDACIÓN HOSPITAL UNIVERSIDAD DEL NORTE,Evento,183153667.0,Abril 2024,Evento
EPSS10,EPS SURA,890113431.0,CEDIUL S.A.,Evento,18152064.0,Abril 2024,Evento
EPSS10,EPS SURA,890200500.0,EMPRESA SOCIAL DEL ESTADO HOSPITAL PSIQUIÁTRICO SAN CAMILO,Evento,20173792.0,Abril 2024,Evento
EPSS10,EPS SURA,890201397.0,ASOCIACION SANTANDEREANA PRO-NIÑO RETARDADO MENTAL,Evento,2346494.0,Abril 2024,Evento
EPSS10,EPS SURA,890202024.0,EMPRESA SOCIAL DEL ESTADO HOSPITAL SAN JUAN DE DIOS DE FLORIDABLANCA,Evento,30242298.0,Abril 2024,Evento
EPSS10,EPS SURA,890203242.0,CLÍNICA GIRON ESE,Evento,1516185.0,Abril 2024,Evento
EPSS10,EPS SURA,890203436.0,ESE HOSPITAL SAN JUAN DE DIOS DE LEBRIJA,Evento,4156984.0,Abril 2024,Evento
EPSS10,EPS SURA,890204360.0,EMPRESA SOCIAL DEL ESTADO SAN ANTONIO RIONEGRO SANTANDER,Evento,1931316.0,Abril 2024,Evento
EPSS10,EPS SURA,890205361.0,FUNDACION OFTALMOLOGICA DE SANTANDER - FOSCAL,Evento,8856501.0,Abril 2024,Evento
EPSS10,EPS SURA,890208758.0,CLINICA MATERNO INFANTIL SAN LUIS S.A,Evento,216983420.0,Abril 2024,Evento
EPSS10,EPS SURA,890209698.0,CLINICA CHICAMOCHA S.A,Evento,439534287.0,Abril 2024,Evento
EPSS10,EPS SURA,890211722.0,CLINICA SAN PABLO SA,Evento,28508272.0,Abril 2024,Evento
EPSS10,EPS SURA,890212568.0,FUNDACION CARDIOVASCULAR DE COLOMBIA,Evento,559525252.0,Abril 2024,Evento
EPSS10,EPS SURA,890300513.0,CLINICA DE OCCIDENTE,Evento,383599837.0,Abril 2024,Evento
EPSS10,EPS SURA,890301430.0,CLINICA NUESTRA SEÑORA DE LOS REMEDIOS,Evento,47073159.0,Abril 2024,Evento
EPSS10,EPS SURA,890303208.0,CAJA DE COMPENSACIÓN FAMILIAR DEL VALLE DEL CAUCA - COMFAMILIAR ANDI,Evento,5907705.0,Abril 2024,Evento
EPSS10,EPS SURA,890303395.0,INSTITUTO PARA NIÑOS CIEGOS Y SORDOS DEL VALLE DEL CAUCA,Evento,139980000.0,Abril 2024,Evento
EPSS10,EPS SURA,890303461.0,E.S.E. HOSPITAL UNIVERSITARIO DEL VALLE EVARISTO GARCIA EMPRESA SOCIAL DEL ESTADO,Evento,20513626.0,Abril 2024,Evento
EPSS10,EPS SURA,890303841.0,HOSPITAL DE SAN JUAN DE DIOS,Evento,1350980.0,Abril 2024,Evento
EPSS10,EPS SURA,890305496.0,E.S.E. HOSPITAL LOCAL JOSE RUFINO VIVAS EMPRESA SOCIAL DEL ESTADO,Evento,1097070.0,Abril 2024,Evento
EPSS10,EPS SURA,890306950.0,E.S.E. HOSPITAL PILOTO JAMUNDI EMPRESA SOCIAL DEL ESTADO,Evento,19185612.0,Abril 2024,Evento
EPSS10,EPS SURA,890307200.0,CLÍNICA IMBANACO S.A.S.,Evento,850991946.0,Abril 2024,Evento
EPSS10,EPS SURA,890324177.0,FUNDACION VALLE DEL LILI,Evento,831615774.0,Abril 2024,Evento
EPSS10,EPS SURA,890399020.0,FUNDACION CLINICA INFANTIL CLUB NOEL,Evento,102580662.0,Abril 2024,Evento
EPSS10,EPS SURA,890400693.0,CLINICA BLAS DE LEZO S.A.S,Evento,104126280.0,Abril 2024,Evento
EPSS10,EPS SURA,890480135.0,FUNDACION HOSPITAL INFANTIL NAPOLEON FRANCO PAREJA,Evento,4948962.0,Abril 2024,Evento
EPSS10,EPS SURA,890500060.0,CLINICA SANTA ANA S.A.,Evento,18635768.0,Abril 2024,Evento
EPSS10,EPS SURA,890501438.0,E.S.E. HOSPITAL EMIRO QUINTERO CAÑIZARES,Evento,14186180.0,Abril 2024,Evento
EPSS10,EPS SURA,890680025.0,E.S.E. HOSPITAL SAN RAFAEL DE FUSAGASUGA,Evento,16134324.0,Abril 2024,Evento
EPSS10,EPS SURA,890700901.0,HOSPITAL SAN VICENTE DE PAUL EMPRESA SOCIAL DEL ESTADO,Evento,1146830.0,Abril 2024,Evento
EPSS10,EPS SURA,890701715.0,E.S.E. HOSPITAL SAN ANTONIO,Evento,2114300.0,Abril 2024,Evento
EPSS10,EPS SURA,890701718.0,HOSPITAL REGIONAL ALFONSO JARAMILLO SALAZAR EMPRESA SOCIAL DEL ESTADO,Evento,3988150.0,Abril 2024,Evento
EPSS10,EPS SURA,890703630.0,SOCIEDAD MÉDICOQUIRÚRGICA DEL TOLIMA SOCIEDAD ANÓNIMA Y/O CLÍNICA TOLIMA S.A.,Evento,5094674.0,Abril 2024,Evento
EPSS10,EPS SURA,890706067.0,HOSPITAL SAN JOSÉ,Evento,1419353.0,Abril 2024,Evento
EPSS10,EPS SURA,890706833.0,E.S.E. HOSPITAL FEDERICO LLERAS ACOSTA,Evento,18044784.0,Abril 2024,Evento
EPSS10,EPS SURA,890801026.0,E.S.E. HOSPITAL DEPARTAMENTAL FELIPE SUAREZ,Evento,12068810.0,Abril 2024,Evento
EPSS10,EPS SURA,890801035.0,E.S.E. HOSPITAL SAN JOSE DE AGUADAS,Evento,7998364.0,Abril 2024,Evento
EPSS10,EPS SURA,890801099.0,ESE HOSPITAL DEPARTAMENTAL UNIVERSITARIO SANTA SOFIA DE CALDAS,Evento,203806012.0,Abril 2024,Evento
EPSS10,EPS SURA,890801160.0,HERMANAS DE LA CARIDAD DOMINICAS DE LA PRESENTACION DE LA SANTISIMA VIRGEN,Evento,101265506.0,Abril 2024,Evento
EPSS10,EPS SURA,890801201.0,CRUZ ROJA COLOMBIANA SECCIONAL CALDAS,Evento,112230011.0,Abril 2024,Evento
EPSS10,EPS SURA,890801235.0,HOSPITAL DEPARTAMENTAL SAN RAFAEL DE RISARALDA EMPRESA SOCIAL DEL ESTADO,Evento,1580143.0,Abril 2024,Evento
EPSS10,EPS SURA,890801495.0,CLINICA PSIQUIATRICA SAN JUAN DE DIOS,Evento,184793703.0,Abril 2024,Evento
EPSS10,EPS SURA,890801517.0,E.S.E. HOSPITAL SANTA TERESITA,Evento,29824016.0,Abril 2024,Evento
EPSS10,EPS SURA,890801562.0,ESE HOSPITAL DEPARTAMENTAL SAN JOSE DE NEIRA,Evento,1924097.0,Abril 2024,Evento
EPSS10,EPS SURA,890801719.0,E.S.E. HOSPITAL LOCAL SAN JUAN DE DIOS,Evento,11256320.0,Abril 2024,Evento
EPSS10,EPS SURA,890801989.0,HOSPITAL DEPARTAMENTAL SAN JUAN DE DIOS DE RIOSUCIO CALDAS ESE,Evento,11747700.0,Abril 2024,Evento
EPSS10,EPS SURA,890802036.0,E.S.E. HOSPITAL SAN MARCOS,Evento,18087523.0,Abril 2024,Evento
EPSS10,EPS SURA,890802218.0,ESE HOSPITAL DEPARTAMENTAL SAN VICENTE DE PAUL,Evento,6340938.0,Abril 2024,Evento
EPSS10,EPS SURA,890802223.0,E.S.E. HOSPITAL SAN BERNARDO,Evento,1253509.0,Abril 2024,Evento
EPSS10,EPS SURA,890805923.0,INSTITUTO OFTALMOLOGICO DE CALDAS S.A.,Evento,51133445.0,Abril 2024,Evento
EPSS10,EPS SURA,890806490.0,CAJA DE COMPENSACION FAMILIAR DE CALDAS,Evento,213890576.0,Abril 2024,Evento
EPSS10,EPS SURA,890807591.0,SERVICIOS ESPECIALES DE SALUD-SES HOSPITAL UNIVERSITARIO DE CALDAS,Evento,385164861.0,Abril 2024,Evento
EPSS10,EPS SURA,890900518.0,FUNDACION HOSPITALARIA SAN VICENTE DE PAUL,Evento,1072426227.0,Abril 2024,Evento
EPSS10,EPS SURA,890900650.0,ORGANIZACION SANTA LUCIA S.A.,Evento,314922033.0,Abril 2024,Evento
EPSS10,EPS SURA,890901684.0,FUNDACION HOSPITAL INFANTIL SANTA ANA,Evento,19712292.0,Abril 2024,Evento
EPSS10,EPS SURA,890901825.0,FUNDACIÓN CLÍNICA NOEL,Evento,18472749.0,Abril 2024,Evento
EPSS10,EPS SURA,890901826.0,HOSPITAL PABLO TOBON URIBE,Evento,954594265.0,Abril 2024,Evento
EPSS10,EPS SURA,890902922.0,UNIVERSIDAD PONTIFICIA BOLIVARIANA,Evento,280504466.0,Abril 2024,Evento
EPSS10,EPS SURA,890903777.0,SOCIEDAD MEDICA ANTIOQUEÑA S.A. SOMA,Evento,533343889.0,Abril 2024,Evento
EPSS10,EPS SURA,890904646.0,HOSPITAL GENERAL DE MEDELLIN LUZ CASTRO DE GUTIERREZ EMPRESA SOCIAL DEL ESTADO,Evento,51283015.0,Abril 2024,Evento
EPSS10,EPS SURA,890905097.0,E.S.E. HOSPITAL FRANCISCO ELADIO BARRERA,Evento,37173437.0,Abril 2024,Evento
EPSS10,EPS SURA,890905154.0,CLINICA SAN JUAN DE DIOS LA CEJA,Evento,250681924.0,Abril 2024,Evento
EPSS10,EPS SURA,890905166.0,E.S.E. HOSPITAL MENTAL DE ANTIOQUIA MARÍA UPEGUI - HOMO,Evento,49431187.0,Abril 2024,Evento
EPSS10,EPS SURA,890905177.0,E.S.E. HOSPITAL LA MARIA,Evento,2634829.0,Abril 2024,Evento
EPSS10,EPS SURA,890905193.0,ESE HOSPITAL SAN VICENTE DE PAUL,Evento,11807842.0,Abril 2024,Evento
EPSS10,EPS SURA,890905198.0,EMPRESA SOCIAL DEL ESTADO HOSPITAL SANTAMARIA,Evento,5642518.0,Abril 2024,Evento
EPSS10,EPS SURA,890905843.0,COMUNIDAD DE HERMANAS DOMINICAS DE LA PRESENTACION DE LA SANTISIMA VIRGEN DE TOURS PROVINCIA DE MEDELLIN,Evento,477612132.0,Abril 2024,Evento
EPSS10,EPS SURA,890906211.0,E.S.E. HOSPITAL MUNICIPAL SAN ROQUE,Evento,2651556.0,Abril 2024,Evento
EPSS10,EPS SURA,890906344.0,EMPRESA SOCIAL DEL ESTADO HOSPITAL SAN RAFAEL,Evento,8745226.0,Abril 2024,Evento
EPSS10,EPS SURA,890906346.0,ESE HOSPITAL SAN FERNANDO,Evento,8760706.0,Abril 2024,Evento
EPSS10,EPS SURA,890906347.0,ESE HOSPITAL MANUEL URIBE ANGEL,Evento,237330911.0,Abril 2024,Evento
EPSS10,EPS SURA,890906991.0,EMPRESA SOCIAL DEL ESTADO HOSPITAL MARIA ANTONIA TORO DE ELEJALDE,Evento,3176313.0,Abril 2024,Evento
EPSS10,EPS SURA,890907215.0,E.S.E. HOSPITAL SAN VICENTE DE PAÚL DE CALDAS,Evento,81263024.0,Abril 2024,Evento
EPSS10,EPS SURA,890907241.0,E.S.E. HOSPITAL LA MERCED DE CIUDAD BOLIVAR,Evento,12031754.0,Abril 2024,Evento
EPSS10,EPS SURA,890907254.0,HOSPITAL SAN JUAN DE DIOS E.S.E RIONEGRO - ANTIOQUIA,Evento,59065434.0,Abril 2024,Evento
EPSS10,EPS SURA,890907279.0,EMPRESA SOCIAL DEL ESTADO HOSPITAL SAN JUAN DE DIOS,Evento,4168422.0,Abril 2024,Evento
EPSS10,EPS SURA,890907297.0,ESE HOSPITAL SAN JUAN DE DIOS,Evento,2878409.0,Abril 2024,Evento
EPSS10,EPS SURA,890911816.0,CLINICA MEDELLIN S.A.S.,Evento,785827765.0,Abril 2024,Evento
EPSS10,EPS SURA,890920848.0,HERNAN OCAZIONEZ Y CIA S.A.S,Evento,74055509.0,Abril 2024,Evento
EPSS10,EPS SURA,890925336.0,CLINICA DE CIRUGIA AMBULATORIA CONQUISTADORES S.A.,Evento,44295590.0,Abril 2024,Evento
