EPSI06,PIJAOS ,860007373.0,FUNDACION HOSPITAL SAN CARLOS,Evento,30000000.0,Abril 2024,Evento
EPSI06,PIJAOS ,860009555.0,E.S.E. HOSPITAL SANTA MATILDE DE MADRID,Evento,2678791.0,Abril 2024,Evento
EPSI06,PIJAOS ,860013779.0,ASOCIACIÓN PROFAMILIA,Evento,28366438.0,Abril 2024,Evento
EPSI06,PIJAOS ,860015536.0,HOSPITAL UNIVERSITARIO SAN IGNACIO,Evento,5000000.0,Abril 2024,Evento
EPSI06,PIJAOS ,860023878.0,EMPRESA SOCIAL DEL ESTADO HOSPITAL DIVINO SALVADOR DE SOPO,Evento,1506310.0,Abril 2024,Evento
EPSI06,PIJAOS ,860037950.0,FUNDACION SANTA FE DE BOGOTA,Evento,30000000.0,Abril 2024,Evento
EPSI06,PIJAOS ,890000992.0,EMPRESA SOCIAL DEL ESTADO HOSPITAL MENTAL DE FILANDIA,Evento,35000000.0,Abril 2024,Evento
EPSI06,PIJAOS ,890303461.0,E.S.E. HOSPITAL UNIVERSITARIO DEL VALLE EVARISTO GARCIA EMPRESA SOCIAL DEL ESTADO,Evento,28000000.0,Abril 2024,Evento
EPSI06,PIJAOS ,890324177.0,FUNDACION VALLE DEL LILI,Evento,10000000.0,Abril 2024,Evento
EPSI06,PIJAOS ,890700694.0,HOSPITAL MARIA INMACULADA E.S.E,Evento,1500000.0,Abril 2024,Evento
EPSI06,PIJAOS ,890700967.0,HOSPITAL SAN JOSE DE ORTEGA,Evento,1500000.0,Abril 2024,Evento
EPSI06,PIJAOS ,890701033.0,E.S.E. HOSPITAL SAN RAFAEL DE EL ESPINAL EMPRESA SOCIAL DEL ESTADO,Evento,90000000.0,Abril 2024,Evento
EPSI06,PIJAOS ,890701300.0,HOSPITAL SAN CARLOS ESE SALDAÑA TOLIMA,Evento,40000000.0,Abril 2024,Evento
EPSI06,PIJAOS ,890701353.0,NUEVO HOSPITAL LA CANDELARIA,Evento,100000000.0,Abril 2024,Evento
EPSI06,PIJAOS ,890701459.0,E.S.E. HOSPITAL SAN JUAN BAUTISTA,Evento,400000000.0,Abril 2024,Evento
EPSI06,PIJAOS ,890701490.0,E.S.E. HOSPITAL SAN VICENTE DE PAUL,Evento,20000000.0,Abril 2024,Evento
EPSI06,PIJAOS ,890701715.0,E.S.E. HOSPITAL SAN ANTONIO,Evento,3379180.0,Abril 2024,Evento
EPSI06,PIJAOS ,890701718.0,HOSPITAL REGIONAL ALFONSO JARAMILLO SALAZAR EMPRESA SOCIAL DEL ESTADO,Evento,5728152.0,Abril 2024,Evento
EPSI06,PIJAOS ,890701922.0,HOSPITAL LA MISERICORDIA E.S.E,Evento,5000000.0,Abril 2024,Evento
EPSI06,PIJAOS ,890703266.0,HOSPITAL NUESTRA SEÑORA DE LOURDES EMPRESA SOCIAL DEL ESTADO DE ATACO TOLIMA,Evento,55000000.0,Abril 2024,Evento
EPSI06,PIJAOS ,890703630.0,SOCIEDAD MÉDICOQUIRÚRGICA DEL TOLIMA SOCIEDAD ANÓNIMA Y/O CLÍNICA TOLIMA S.A.,Evento,200000000.0,Abril 2024,Evento
EPSI06,PIJAOS ,890703803.0,INSTIT DE REHABILIT DEL TOL IDEAL,Evento,2000000.0,Abril 2024,Evento
EPSI06,PIJAOS ,890704495.0,HOSPITAL SAN ROQUE EMPRESA SOCIAL DEL ESTADO NIVEL I,Evento,50000000.0,Abril 2024,Evento
EPSI06,PIJAOS ,890704555.0,HOSPITAL CENTRO E.S.E. DE PLANADAS,Evento,4000000.0,Abril 2024,Evento
EPSI06,PIJAOS ,890706823.0,HOSPITAL REINA SOFIA DE ESPAÑA EMPRESA SOCIAL DEL ESTADO LERIDA TOLIMA,Evento,4026740.0,Abril 2024,Evento
EPSI06,PIJAOS ,890706833.0,E.S.E. HOSPITAL FEDERICO LLERAS ACOSTA,Evento,200000000.0,Abril 2024,Evento
EPSI06,PIJAOS ,890801099.0,ESE HOSPITAL DEPARTAMENTAL UNIVERSITARIO SANTA SOFIA DE CALDAS,Evento,20000000.0,Abril 2024,Evento
EPSI06,PIJAOS ,890801989.0,HOSPITAL DEPARTAMENTAL SAN JUAN DE DIOS DE RIOSUCIO CALDAS ESE,Evento,35000000.0,Abril 2024,Evento
EPSI06,PIJAOS ,890904646.0,HOSPITAL GENERAL DE MEDELLIN LUZ CASTRO DE GUTIERREZ EMPRESA SOCIAL DEL ESTADO,Evento,8000000.0,Abril 2024,Evento
EPSI06,PIJAOS ,891180134.0,E.S.E. HOSPITAL DEPARTAMENTAL SAN ANTONIO DE PITALITO,Evento,10000000.0,Abril 2024,Evento
EPSI06,PIJAOS ,891180268.0,E.S.E. HOSPITAL UNIVERSITARIO HERNANDO MONCALEANO PERDOMO DE NEIVA,Evento,70000000.0,Abril 2024,Evento
EPSI06,PIJAOS ,891401308.0,EMPRESA SOCIAL DEL ESTADO HOSPITAL NAZARETH QUINCHIA,Evento,10000000.0,Abril 2024,Evento
EPSI06,PIJAOS ,891401643.0,EMPRESA SOCIAL DEL ESTADO HOSPITAL SAN PEDRO Y SAN PABLO LA VIRGINIA,Evento,20000000.0,Abril 2024,Evento
EPSI06,PIJAOS ,891401777.0,EMPRESA SOCIAL DEL ESTADO HOSPITAL SAN VICENTE DE PAUL SANTUARIO,Evento,8000000.0,Abril 2024,Evento
EPSI06,PIJAOS ,891408918.0,EMPRESA SOCIAL DEL ESTADO HOSPITAL SAN JOSE,Evento,10000000.0,Abril 2024,Evento
EPSI06,PIJAOS ,891408974.0,INSTITUTO DE AUDIOLOGIA INTEGRAL,Evento,5000000.0,Abril 2024,Evento
EPSI06,PIJAOS ,891409017.0,EMPRESA SOCIAL DEL ESTADO HOSPITAL SAN VICENTE DE PAUL APIA,Evento,1978050.0,Abril 2024,Evento
EPSI06,PIJAOS ,891409025.0,ESE HOSPITAL SAN RAFAEL,Evento,4000000.0,Abril 2024,Evento
EPSI06,PIJAOS ,891409390.0,RADIOLOGOS ASOCIADOS S.A.S,Evento,6000000.0,Abril 2024,Evento
EPSI06,PIJAOS ,891410661.0,ESE HOSPITAL SANTA ANA,Evento,15000000.0,Abril 2024,Evento
EPSI06,PIJAOS ,891411663.0,ESE HOSPITAL SANTA MÓNICA,Evento,6976076.0,Abril 2024,Evento
EPSI06,PIJAOS ,891411665.0,EMPRESA SOCIAL DEL ESTADO HOSPITAL CRISTO REY,Evento,1353779.0,Abril 2024,Evento
EPSI06,PIJAOS ,891412126.0,ESE HOSPITAL SAN VICENTE DE PAUL.,Evento,35000000.0,Abril 2024,Evento
EPSI06,PIJAOS ,891412134.0,E.S.E. HOSPITAL MENTALUNIVERSITARIO DE RISARALDA,Evento,25000000.0,Abril 2024,Evento
EPSI06,PIJAOS ,891480000.0,CAJA DE COMPENSACION FAMILIAR DE RISARALDA COMFAMILIAR RISARALDA,Evento,35000000.0,Abril 2024,Evento
EPSI06,PIJAOS ,891480036.0,EMPRESA SOCIAL DEL ESTADO HOSPITAL SAN VICENTE DE PAUL SANTA ROSA DE CABAL,Evento,2259233.0,Abril 2024,Evento
EPSI06,PIJAOS ,891500084.0,HOSPITAL FRANCISCO DE PAULA SANTANDER E.S.E. NIVEL II,Evento,1097786.0,Abril 2024,Evento
EPSI06,PIJAOS ,891901158.0,E.S.E HOSPITAL DEPARTAMENTAL TOMAS URIBE URIBE DE TULUA EMPRESA SOCIAL DEL ESTADO,Evento,20000000.0,Abril 2024,Evento
EPSI06,PIJAOS ,892000501.0,HOSPITAL DEPARTAMENTAL DE VILLAVICENCIO E.S.E.,Evento,250000000.0,Abril 2024,Evento
EPSI06,PIJAOS ,899999032.0,EMPRESA SOCIAL DEL ESTADO HOSPITAL UNIVERSITARIO DE LA SAMARITANA,Evento,13000000.0,Abril 2024,Evento
EPSI06,PIJAOS ,899999092.0,INSTITUTO NACIONAL DE CANCEROLOGIA,Evento,100000000.0,Abril 2024,Evento
EPSI06,PIJAOS ,899999123.0,FUNDACION HOSPITAL DE LA MISERICORDIA,Evento,28000000.0,Abril 2024,Evento
EPSI06,PIJAOS ,900074359.0,UCIMED S.A,Evento,12000000.0,Abril 2024,Evento
EPSI06,PIJAOS ,900123436.0,SOCIEDAD INTEGRAL DE ESPECIALISTAS EN SALUD S.A.S SIGLA SIES SALUD S.A.S,Evento,50000000.0,Abril 2024,Evento
EPSI06,PIJAOS ,900123612.0,NEFROUROS MOM SAS,Evento,120000000.0,Abril 2024,Evento
EPSI06,PIJAOS ,900138815.0,UNIDAD MATERNO INFANTIL DEL TOLIMA S.A.,Evento,120000000.0,Abril 2024,Evento
EPSI06,PIJAOS ,900144408.0,OXITOLIMA S.A IPS,Evento,30000000.0,Abril 2024,Evento
EPSI06,PIJAOS ,900150760.0,RESPIREMOS UNIDAD DE NEUMOLOGIA Y ENDOSCOPIA RESPIRATORIA DEL EJE CAFETERO S.A.S,Evento,10000000.0,Abril 2024,Evento
EPSI06,PIJAOS ,900171211.0,GLOBAL LIFE AMBULANCIAS SAS,Evento,1381173.0,Abril 2024,Evento
EPSI06,PIJAOS ,900181419.0,MEINTEGRAL S.A.S,Evento,250000000.0,Abril 2024,Evento
EPSI06,PIJAOS ,900185047.0,OXYCENTER HOME CARE S.A.S,Evento,5000000.0,Abril 2024,Evento
EPSI06,PIJAOS ,900193162.0,INSTITUTO DE ULTRATECNOLOGIA MEDICA S A S,Evento,90000000.0,Abril 2024,Evento
EPSI06,PIJAOS ,900202290.0,AUDIOSALUD INTEGRAL SAS,Evento,20000000.0,Abril 2024,Evento
EPSI06,PIJAOS ,900215983.0,CLINICA BELO HORIZONTE SAS,Evento,40000000.0,Abril 2024,Evento
EPSI06,PIJAOS ,900246313.0,IPS INTEGRAL SOMOS SALUD SAS,Evento,9000000.0,Abril 2024,Evento
EPSI06,PIJAOS ,900264583.0,ONCO-ORIENTE S.A.S,Evento,7000000.0,Abril 2024,Evento
EPSI06,PIJAOS ,900267104.0,UNIDAD INTEGRAL DE REHABILITACION CARDIO-PULMONAR E.U.,Evento,8028589.0,Abril 2024,Evento
EPSI06,PIJAOS ,900269973.0,LABORATORIO BIOANALISIS SAS,Evento,38000000.0,Abril 2024,Evento
EPSI06,PIJAOS ,900328450.0,CENTRO DE NEUROREHABILITACION APAES SAS,Evento,12473702.0,Abril 2024,Evento
EPSI06,PIJAOS ,900342064.0,SOCIEDAD COMERCIALIZADORA DE INSUMOS Y SERVICIOS MÉDICOS S.A.S,Evento,60000000.0,Abril 2024,Evento
EPSI06,PIJAOS ,900346953.0,CARDIOSALUD EJE CAFETERO S.A.S.,Evento,15000000.0,Abril 2024,Evento
EPSI06,PIJAOS ,900377863.0,UNION DE CIRUJANOS S.A.S.,Evento,4000000.0,Abril 2024,Evento
EPSI06,PIJAOS ,900385628.0,MEDICENTRO FAMILIAR IPS SAS,Evento,10000000.0,Abril 2024,Evento
EPSI06,PIJAOS ,900413988.0,NP MEDICAL IPS SAS,Evento,15000000.0,Abril 2024,Evento
EPSI06,PIJAOS ,900422064.0,CENTRO ESPECIALIZADO DE UROLOGIA S.A.S,Evento,9000000.0,Abril 2024,Evento
EPSI06,PIJAOS ,900428930.0,CLINICAONCOSALUD I.P.S.S.A.S,Evento,120000000.0,Abril 2024,Evento
EPSI06,PIJAOS ,900458032.0,SERVICIO CARDIOCRITICO DEL TOLIMA S.A.S.,Evento,30000000.0,Abril 2024,Evento
EPSI06,PIJAOS ,900470918.0,GRUPO CUIDAR SAS,Evento,1540288.0,Abril 2024,Evento
EPSI06,PIJAOS ,900471504.0,CLÍNICA LAS VICTORIAS - FRACTURAS,Evento,13000000.0,Abril 2024,Evento
EPSI06,PIJAOS ,900476649.0,INVERAUDIT SAS,Evento,150000000.0,Abril 2024,Evento
EPSI06,PIJAOS ,900494089.0,CENDITER S.A.S.,Evento,30000000.0,Abril 2024,Evento
EPSI06,PIJAOS ,900497208.0,INSTITUTO VASCULAR E IMÁGENES DIAGNOSTICAS SAS,Evento,40000000.0,Abril 2024,Evento
EPSI06,PIJAOS ,900520501.0,TOLIMEDICA SAS,Evento,20000000.0,Abril 2024,Evento
EPSI06,PIJAOS ,900543368.0,UROLOGYN CARE IPS S.A.S,Evento,25000000.0,Abril 2024,Evento
EPSI06,PIJAOS ,900547903.0,PREVENCION INTEGRAL EN SALUD IPS S.A.S,Evento,35580915.0,Abril 2024,Evento
EPSI06,PIJAOS ,900576732.0,TRAUMASUR TIENDA DE LA SALUD SAS,Evento,400000000.0,Abril 2024,Evento
EPSI06,PIJAOS ,900579362.0,CLINICA OFTALMÓLOGICA VISIÓN COLOMBIA SAS Y/O UNIDAD DE DIAGNOSTICO MEDICO UNIDIME SAS,Evento,3000000.0,Abril 2024,Evento
EPSI06,PIJAOS ,900580962.0,DISFARMA G.C. S.A.S.,Evento,492366074.0,Abril 2024,Evento
EPSI06,PIJAOS ,900589109.0,MEDICINA NUCLEAR DE BOGOTA S.A.S,Evento,4000000.0,Abril 2024,Evento
EPSI06,PIJAOS ,900600212.0,CARDIOLOGIA SIGLO XXI,Evento,30000000.0,Abril 2024,Evento
EPSI06,PIJAOS ,900622320.0,GASTROKIDS SAS,Evento,80000000.0,Abril 2024,Evento
EPSI06,PIJAOS ,900624392.0,ALTILLANURA AMBULANCIAS Y SERVICIOS MEDICOS SAS,Evento,150000000.0,Abril 2024,Evento
EPSI06,PIJAOS ,900693770.0,MEDICAL LIFE CARE S.A.S.,Evento,40000000.0,Abril 2024,Evento
EPSI06,PIJAOS ,900718172.0,CLINICA INTERNACIONAL DE ALTA TECNOLOGIA CLINALTEC S.A.S.,Evento,200000000.0,Abril 2024,Evento
EPSI06,PIJAOS ,900830994.0,ALVIHOUSE I.P.S S.A.S.,Evento,12000000.0,Abril 2024,Evento
EPSI06,PIJAOS ,900871885.0,CENTRAL DE ESPECIALISTAS DE COLOMBIA S.A.S.,Evento,50000000.0,Abril 2024,Evento
EPSI06,PIJAOS ,900900122.0,HEALTH & LIFE IPS SAS SIGLA H&L UCC SAS,Evento,45000000.0,Abril 2024,Evento
EPSI06,PIJAOS ,900911340.0,OPTICAS YAMPAL SAS,Evento,4000000.0,Abril 2024,Evento
EPSI06,PIJAOS ,900958564.0,SUBRED INTEGRADA DE SERVICIOS DE SALUD SUR E.S.E.,Evento,54286397.0,Abril 2024,Evento
EPSI06,PIJAOS ,900959048.0,SUBRED INTEGRADA DE SERVICIOS DE SALUD SUR OCCIDENTE E.S.E,Evento,30000000.0,Abril 2024,Evento
EPSI06,PIJAOS ,900959051.0,SUBRED INTEGRADA DE SERVICIOS DE SALUD CENTRO ORIENTE E.S.E,Evento,70000000.0,Abril 2024,Evento
EPSI06,PIJAOS ,900971006.0,SUBRED INTEGRADA DE SERVICIOS DE SALUD NORTE E.S.E,Evento,60000000.0,Abril 2024,Evento
EPSI06,PIJAOS ,900994370.0,NEUROCAD SAS,Evento,30000000.0,Abril 2024,Evento
EPSI06,PIJAOS ,901112813.0,CLINNOVA CLINICA DE HERIDAS Y OSTOMIAS SAS,Evento,17000000.0,Abril 2024,Evento
EPSI06,PIJAOS ,901120152.0,HOGAR DE PASO ITZAYANA SAS,Evento,27000000.0,Abril 2024,Evento
EPSI06,PIJAOS ,901164974.0,JUNICAL MEDICAL S.A.S.,Evento,14000000.0,Abril 2024,Evento
EPSI06,PIJAOS ,901217765.0,UNIÓN MENTAL SAS,Evento,2000000.0,Abril 2024,Evento
EPSI06,PIJAOS ,901223046.0,SHARON MEDICAL GROUP SAS,Evento,400000000.0,Abril 2024,Evento
EPSI06,PIJAOS ,901352353.0,CLINICA LA SAGRADA FAMILIA SAS,Evento,150000000.0,Abril 2024,Evento
EPSI06,PIJAOS ,901532463.0,HOSPITAL DE ALTA COMPLEJIDAD DEL MAGDALENA CENTRO S.A.S,Evento,3724693.0,Abril 2024,Evento
EPSS01,ALIANSALUD E.P.S. S.A.,800149453.0,CPO SA,Evento,1351297.0,Abril 2024,Evento
EPSS01,ALIANSALUD E.P.S. S.A.,830027158.0,RIESGO DE FRACTURA S.A. CAYRE,Evento,1355422.0,Abril 2024,Evento
EPSS01,ALIANSALUD E.P.S. S.A.,860007760.0,HERMANAS HOSPITALARIAS DEL SAGRADO CORAZÓN DE JESÚS,Evento,10029744.0,Abril 2024,Evento
EPSS01,ALIANSALUD E.P.S. S.A.,860015536.0,HOSPITAL UNIVERSITARIO SAN IGNACIO,Evento,43893625.0,Abril 2024,Evento
EPSS01,ALIANSALUD E.P.S. S.A.,860090566.0,CLINICA DEL OCCIDENTE S.A.,Evento,10786793.0,Abril 2024,Evento
EPSS01,ALIANSALUD E.P.S. S.A.,899999017.0,SOCIEDAD DE CIRUGIA DE BOGOTA HOSPITAL DE SAN JOSE,Evento,2071782.0,Abril 2024,Evento
EPSS01,ALIANSALUD E.P.S. S.A.,899999123.0,FUNDACION HOSPITAL DE LA MISERICORDIA,Evento,4282697.0,Abril 2024,Evento
EPSS01,ALIANSALUD E.P.S. S.A.,900219866.0,MEDICARTE S.A.S,Evento,63967895.0,Abril 2024,Evento
EPSS01,ALIANSALUD E.P.S. S.A.,900578105.0,CORPORACIÓN SALUD UN,Evento,1379171.0,Abril 2024,Evento
EPSS02,SALUD TOTAL,800000118.0,EMPRESA SOCIAL DEL ESTADO HOSPITAL DEPARTAMENTAL UNIVERSITARIO DEL QUINDIO SAN JUAN DE DIOS,Evento,310855731.0,Abril 2024,Evento
EPSS02,SALUD TOTAL,800003765.0,VIRREY SOLIS IPS SA,Evento,9189477560.0,Abril 2024,Evento
EPSS02,SALUD TOTAL,800004808.0,CLÍNICA SANTA CLARA SAS,Evento,44291764.0,Abril 2024,Evento
EPSS02,SALUD TOTAL,800006850.0,EMPRESA SOCIAL DEL ESTADO REGION DE SALUD SOACHA,Evento,13679723.0,Abril 2024,Evento
EPSS02,SALUD TOTAL,800008240.0,UNIDAD OFTALMOLOGICA DE CARTAGENA S.A.S,Evento,87520452.0,Abril 2024,Evento
EPSS02,SALUD TOTAL,800014405.0,ESE HOSPITAL SANTA ISABEL,Evento,5149996.0,Abril 2024,Evento
EPSS02,SALUD TOTAL,800014918.0,E.S.E. HOSPITAL UNIVERSITARIO ERASMO MEOZ,Evento,62935443.0,Abril 2024,Evento
EPSS02,SALUD TOTAL,800025221.0,E.S.E. HOSPITAL SAN ISIDRO,Evento,18999495.0,Abril 2024,Evento
EPSS02,SALUD TOTAL,800025755.0,IPS CLINICA SAN IGNACIO LTDA,Evento,63000401.0,Abril 2024,Evento
EPSS02,SALUD TOTAL,800026173.0,ESE HOSPITAL HELI MORENO BLANCO,Evento,5235589.0,Abril 2024,Evento
EPSS02,SALUD TOTAL,800030924.0,E.S.E. HOSPITAL LA BUENA ESPERANZA,Evento,6896666.0,Abril 2024,Evento
EPSS02,SALUD TOTAL,800031212.0,UNIDAD MEDICA RADIOLOGICA DEL CARMEN,Evento,19418070.0,Abril 2024,Evento
EPSS02,SALUD TOTAL,800036400.0,CLINICA IBAGUE S.A,Evento,4330200.0,Abril 2024,Evento
EPSS02,SALUD TOTAL,800037021.0,HOSPITAL DEPARTAMENTAL DE GRANADA - EMPRESA SOCIAL DEL META,Evento,133481883.0,Abril 2024,Evento
EPSS02,SALUD TOTAL,800037244.0,E.S.E. HOSPITAL GUILLERMO GAVIRIA CORREA,Evento,2123933.0,Abril 2024,Evento
EPSS02,SALUD TOTAL,800037979.0,E.S.E. HOSPITAL LOCAL DE PUERTO LOPEZ,Evento,20587062.0,Abril 2024,Evento
EPSS02,SALUD TOTAL,800044402.0,INVERSIONES MEDICAS DE ANTIOQUIA S.A. CLINICA LAS VEGAS,Evento,1624217.0,Abril 2024,Evento
EPSS02,SALUD TOTAL,800044967.0,ASSBASALUD ESE,Evento,1241176.0,Abril 2024,Evento
EPSS02,SALUD TOTAL,800048954.0,CLINICA VERSALLES S.A.,Evento,148893054.0,Abril 2024,Evento
EPSS02,SALUD TOTAL,800058016.0,EMPRESA SOCIAL DEL ESTADO METROSALUD,Evento,33093049.0,Abril 2024,Evento
EPSS02,SALUD TOTAL,800064543.0,E.S.E. HOSPITAL INTEGRADO SABANA DE TORRES,Evento,26732677.0,Abril 2024,Evento
EPSS02,SALUD TOTAL,800065396.0,INSTITUTO DE DIAGNOSTICO MEDICO S.A.,Evento,969135485.0,Abril 2024,Evento
EPSS02,SALUD TOTAL,800066001.0,CENTRO MEDICO OFTALMOLOGICO Y LABORATORIO CLINICO ANDRADE NARVAEZ SOCIEDAD POR ACCIONES SIMPLIFICADA SIGLA COLCAN S.A.S.,Evento,7292492.0,Abril 2024,Evento
EPSS02,SALUD TOTAL,800067065.0,PROMOTORA MEDICA LAS AMERICAS S.A,Evento,25329931.0,Abril 2024,Evento
EPSS02,SALUD TOTAL,800067515.0,CLINICA LA MILAGROSA SA,Evento,146566528.0,Abril 2024,Evento
EPSS02,SALUD TOTAL,800074112.0,CLINICA ZAYMA S.A.S,Evento,229451914.0,Abril 2024,Evento
EPSS02,SALUD TOTAL,800075650.0,EMPRESA SOCIAL DEL ESTADO HOSPITAL SANTO TOMAS,Evento,53994688.0,Abril 2024,Evento
EPSS02,SALUD TOTAL,800075729.0,GRUPO MEDICO ESPECIALIZADO AIREC,Evento,5749805.0,Abril 2024,Evento
EPSS02,SALUD TOTAL,800080586.0,ESE HOSPITAL SAN JUAN DE DIOS,Evento,2875832.0,Abril 2024,Evento
EPSS02,SALUD TOTAL,800082446.0,INSTITUTO DEL SISTEMA NERVIOSO DE RISARALDA S.A.S,Evento,344599388.0,Abril 2024,Evento
EPSS02,SALUD TOTAL,800084206.0,EMPRESA SOCIAL DEL ESTADO INSTITUTO DE SALUD DE BUCARAMANGA,Evento,20232716.0,Abril 2024,Evento
EPSS02,SALUD TOTAL,800087565.0,SYNLAB COLOMBIA S.A.S.,Evento,180670336.0,Abril 2024,Evento
EPSS02,SALUD TOTAL,800090749.0,CLINICA PIEDECUESTA S.A.,Evento,35623165.0,Abril 2024,Evento
EPSS02,SALUD TOTAL,800094439.0,CATME S.A.S.,Evento,7720702.0,Abril 2024,Evento
EPSS02,SALUD TOTAL,800098895.0,UNIDAD DE MEDICINA PREVENTIVA Y RESOLUTIVA UMPRE LTDA,Evento,6168000.0,Abril 2024,Evento
EPSS02,SALUD TOTAL,800099124.0,EMPRESA SOCIAL DEL ESTADO HOSPITAL SAN JOSE,Evento,1569373.0,Abril 2024,Evento
EPSS02,SALUD TOTAL,800099778.0,ASOCIACIÓN NIÑOS DE PAPEL,Evento,57287786.0,Abril 2024,Evento
EPSS02,SALUD TOTAL,800099860.0,E.S.E. HOSPITAL SAN RAFAEL DE PACHO,Evento,277361885.0,Abril 2024,Evento
EPSS02,SALUD TOTAL,800107179.0,INSTITUTO DEL CORAZON S.A.S,Evento,109132084.0,Abril 2024,Evento
EPSS02,SALUD TOTAL,800114286.0,E.S.E. HOSPITAL SAN CAMILO DE LELIS,Evento,1398648.0,Abril 2024,Evento
EPSS02,SALUD TOTAL,800116719.0,HOSPITAL ESPECIALIZADO GRANJA INTEGRAL E.S.E LERIDA TOLIMA,Evento,99276161.0,Abril 2024,Evento
EPSS02,SALUD TOTAL,800119945.0,HOSPITAL SAN ROQUE ESE,Evento,45315413.0,Abril 2024,Evento
EPSS02,SALUD TOTAL,800122186.0,UROMEDICA LTDA,Evento,14483264.0,Abril 2024,Evento
EPSS02,SALUD TOTAL,800123106.0,ESE HOSPITAL VENANCIO DIAZ DIAZ,Evento,18353446.0,Abril 2024,Evento
EPSS02,SALUD TOTAL,800125697.0,E.S.E. HOSPITAL NELSON RESTREPO MARTINEZ,Evento,32142621.0,Abril 2024,Evento
EPSS02,SALUD TOTAL,800129856.0,CLINICA DE LA COSTA S.A.S.,Evento,19916761.0,Abril 2024,Evento
EPSS02,SALUD TOTAL,800130480.0,CENTRO DE MEDICINA NUCLEAR DEL TOLIMA LTDA,Evento,12086557.0,Abril 2024,Evento
EPSS02,SALUD TOTAL,800130625.0,ESE HOSPITAL SAN CRISTOBAL DE CIENAGA,Evento,50172774.0,Abril 2024,Evento
EPSS02,SALUD TOTAL,800131518.0,FUNDACIÓN GRUPO DE ESTUDIO BARRANQUILLA,Evento,7468983.0,Abril 2024,Evento
EPSS02,SALUD TOTAL,800135582.0,FUNDACION ALEJANDRO LONDOÑO,Evento,12292479.0,Abril 2024,Evento
EPSS02,SALUD TOTAL,800138011.0,ESE HOSPITAL LA MISERICORDIA,Evento,5361371.0,Abril 2024,Evento
EPSS02,SALUD TOTAL,800138311.0,EMPRESA SOCIAL DEL ESTADO HOSPITAL NUESTRA SEÑORA DEL CARMEN,Evento,3730278.0,Abril 2024,Evento
EPSS02,SALUD TOTAL,800138968.0,EMPRESA SOCIAL DEL ESTADO HOSPITAL LA ESTRELLA,Evento,6282196.0,Abril 2024,Evento
EPSS02,SALUD TOTAL,800139366.0,HOSPITAL GENERAL SAN ISIDRO EMPRESA SOCIAL DEL ESTADO,Evento,47784633.0,Abril 2024,Evento
EPSS02,SALUD TOTAL,800143438.0,E.S.E. HOSPITAL HECTOR ABAD GOMEZ,Evento,1531586.0,Abril 2024,Evento
EPSS02,SALUD TOTAL,800149453.0,CPO SA,Evento,5396631896.0,Abril 2024,Evento
EPSS02,SALUD TOTAL,800153463.0,CLINICA REVIVIR SA,Evento,4202949.0,Abril 2024,Evento
EPSS02,SALUD TOTAL,800156469.0,IMÁGENES DIAGNOSTICAS DEL LLANO S.A.,Evento,7586349.0,Abril 2024,Evento
EPSS02,SALUD TOTAL,800160400.0,E.S.E. HOSPITAL SANTA MARGARITA,Evento,1801292.0,Abril 2024,Evento
EPSS02,SALUD TOTAL,800161687.0,UNIDAD DE GASTROENTEROLOGIA Y ENDOSCOPIA DIGESTIVA S.A.-UGASEND S.A,Evento,3528000.0,Abril 2024,Evento
EPSS02,SALUD TOTAL,800162035.0,SERVICIOS MEDICOS INTEGRALES DE SALUD SAS SERVIMEDICOS SAS,Evento,96292536.0,Abril 2024,Evento
EPSS02,SALUD TOTAL,800163519.0,HOSPITAL SAN JUAN DE DIOS EMPRESA SOCIAL DEL ESTADO DEL MUNICIPIO DE ANZOATEGUI,Evento,1149970.0,Abril 2024,Evento
EPSS02,SALUD TOTAL,800166631.0,UNIDAD ESTOMATOLOGICA LAS VEGAS S.A,Evento,1233898.0,Abril 2024,Evento
EPSS02,SALUD TOTAL,800174123.0,ESE HOSPITAL DE SANTO TOMAS,Evento,5763816.0,Abril 2024,Evento
EPSS02,SALUD TOTAL,800174375.0,E.S.E. HOSPITAL SAN VICENTE DE PAUL DE FOMEQUE,Evento,2329843.0,Abril 2024,Evento
EPSS02,SALUD TOTAL,800174851.0,SOCIEDAD MEDICO QUIRÚRGICA NUESTRA SEÑORA DE BELÉN DE FUSAGASUGA S.A.S,Evento,158816849.0,Abril 2024,Evento
EPSS02,SALUD TOTAL,800175901.0,CLINICA EMPERATRIZ SAS,Evento,2094631.0,Abril 2024,Evento
EPSS02,SALUD TOTAL,800176868.0,INSTITUTO CALDENSE DE PATOLOGIA ICP SAS,Evento,2189013.0,Abril 2024,Evento
EPSS02,SALUD TOTAL,800179870.0,HOSPITAL SAN ANDRES E.S.E.,Evento,1311648.0,Abril 2024,Evento
EPSS02,SALUD TOTAL,800179966.0,IPS CLINICA REINA CATALINA S.A.S.,Evento,1059207344.0,Abril 2024,Evento
EPSS02,SALUD TOTAL,800182136.0,HOSPITAL SAN ANTONIO E.S.E. DE NATAGAIMA TOLIMA,Evento,3420176.0,Abril 2024,Evento
EPSS02,SALUD TOTAL,800183943.0,CLINICA SANTA MARIA SAS,Evento,313560367.0,Abril 2024,Evento
EPSS02,SALUD TOTAL,800185449.0,AVIDANTI SAS,Evento,1000124572.0,Abril 2024,Evento
EPSS02,SALUD TOTAL,800190884.0,CLINICA ANTIOQUIA S.A.,Evento,19642742.0,Abril 2024,Evento
EPSS02,SALUD TOTAL,800191101.0,ESE HOSPITAL SAN VICENTE DE PAUL,Evento,2274640.0,Abril 2024,Evento
EPSS02,SALUD TOTAL,800193392.0,E.S.E. HOSPITAL SAN ISIDRO,Evento,1909071.0,Abril 2024,Evento
EPSS02,SALUD TOTAL,800193801.0,CENTRO OFTALMOLOGICO SURCOLOMBIANO LTDA,Evento,24641929.0,Abril 2024,Evento
EPSS02,SALUD TOTAL,800193912.0,ESE HOSPITAL SAN RAFAEL DE CHINU,Evento,9765845.0,Abril 2024,Evento
EPSS02,SALUD TOTAL,800193989.0,CENTRO DIAGNOSTICO DE ESPECIALISTAS LTDA,Evento,13079551.0,Abril 2024,Evento
EPSS02,SALUD TOTAL,800194627.0,E.S.E. HOSPITAL SAN JOSE DE BELALCAZAR,Evento,6069304.0,Abril 2024,Evento
EPSS02,SALUD TOTAL,800194798.0,ORGANIZACION CLINICA BONNADONA PREVENIR S.A.S.,Evento,689652473.0,Abril 2024,Evento
EPSS02,SALUD TOTAL,800197217.0,CLINICA DE ESPECIALISTAS MARIA AUXILIADORA S.A.S.,Evento,59497276.0,Abril 2024,Evento
EPSS02,SALUD TOTAL,800197601.0,ANGIOGRAFIA DE OCCIDENTE S.A.,Evento,33226319.0,Abril 2024,Evento
EPSS02,SALUD TOTAL,800199976.0,GERMAN PABLO SANDOVAL AUDIOFON S.A.S.,Evento,20051520.0,Abril 2024,Evento
EPSS02,SALUD TOTAL,800200789.0,CLINICA CHIA S.A.S.,Evento,48882497.0,Abril 2024,Evento
EPSS02,SALUD TOTAL,800201197.0,E.S.E. HOSPITAL SAN FRANCISCO,Evento,2569377.0,Abril 2024,Evento
EPSS02,SALUD TOTAL,800201726.0,FUNDACION POLICLINICA CIENAGA,Evento,106132571.0,Abril 2024,Evento
EPSS02,SALUD TOTAL,800204153.0,E.S.E. HOSPITAL SAN VICENTE DE PAUL DE LORICA,Evento,42717567.0,Abril 2024,Evento
EPSS02,SALUD TOTAL,800204919.0,CLINICA RESPIRATORIA Y DE ALERGIAS S.A.S,Evento,16707536.0,Abril 2024,Evento
EPSS02,SALUD TOTAL,800209891.0,CLINICA ASOTRAUMA SAS,Evento,95993038.0,Abril 2024,Evento
EPSS02,SALUD TOTAL,800213121.0,CENTRO CLÍNICO CARVAJAL IPS SAS,Evento,25889115.0,Abril 2024,Evento
EPSS02,SALUD TOTAL,800214230.0,MEDIAGNOSTICA TECMEDI TECNOLOGIA MEDICA DIAGNOSTICA S.A.S,Evento,5792088.0,Abril 2024,Evento
EPSS02,SALUD TOTAL,800215758.0,CLINICA SANTA CRUZ DE LA LOMA S.A,Evento,12524980.0,Abril 2024,Evento
EPSS02,SALUD TOTAL,800217198.0,ONCOMEDIC LIMITADA,Evento,12592508.0,Abril 2024,Evento
EPSS02,SALUD TOTAL,800218196.0,COOPERATIVA DE TRABAJO ASOCIADO REHABILITAMOS,Evento,33849280.0,Abril 2024,Evento
EPSS02,SALUD TOTAL,800222844.0,RADIOIMAGENES RADIOLOGOS ASOCIADOS S.A.S.,Evento,73736196.0,Abril 2024,Evento
EPSS02,SALUD TOTAL,800227072.0,EUSALUD S.A,Evento,1447299.0,Abril 2024,Evento
EPSS02,SALUD TOTAL,800227877.0,EMPRESA SOCIAL DEL ESTADO HOSPITAL FRANCISCO LUIS JIMENEZ MARTINEZ,Evento,5787190.0,Abril 2024,Evento
EPSS02,SALUD TOTAL,800228215.0,CENTRO DE ALTA TECNOLOGIA DIAGNOSTICA DEL EJE CAFETERO S.A. - CEDICAF S.A.,Evento,112627891.0,Abril 2024,Evento
EPSS02,SALUD TOTAL,800228773.0,COOPERATIVA DE TRABAJO ASOCIADO DE PROFESIONALES DE LA SALUD DE DONMATIAS - PROSALCO,Evento,17420144.0,Abril 2024,Evento
EPSS02,SALUD TOTAL,800231215.0,HOSPITAL DEL SARARE ESE,Evento,6740860.0,Abril 2024,Evento
EPSS02,SALUD TOTAL,800231235.0,EMPRESA SOCIAL DEL ESTADO HOSPITAL UNIVERSITARIO SAN JORGE,Evento,416679755.0,Abril 2024,Evento
EPSS02,SALUD TOTAL,800234860.0,LITOTRICIA S.A.,Evento,66126544.0,Abril 2024,Evento
EPSS02,SALUD TOTAL,800236964.0,FOTOTERAPIA BOJANINI Y LOPEZ SAS,Evento,1471985.0,Abril 2024,Evento
EPSS02,SALUD TOTAL,800249700.0,INSTITUTO NEUMOLOGICO DEL ORIENTE S.A.,Evento,55098379.0,Abril 2024,Evento
EPSS02,SALUD TOTAL,800250382.0,AMAREY NOVA MEDICAL S.A.,Evento,44312000.0,Abril 2024,Evento
EPSS02,SALUD TOTAL,800250625.0,CENTRO DE FISIOTERAPIA KENDALL LTDA,Evento,9255802.0,Abril 2024,Evento
EPSS02,SALUD TOTAL,800254850.0,EMPRESA SOCIAL DEL ESTADO HOSPITAL SANTA ANA,Evento,1528945.0,Abril 2024,Evento
EPSS02,SALUD TOTAL,800255963.0,CLINICA SAN JOSE SAS,Evento,111108236.0,Abril 2024,Evento
EPSS02,SALUD TOTAL,801000060.0,SOCIEDAD DE NEUROCIENCIAS DIAGNOSTICAS NEUROIMAGENES S.A,Evento,9351520.0,Abril 2024,Evento
EPSS02,SALUD TOTAL,801000713.0,ONCOLOGOS DEL OCCIDENTE S.A.S.,Evento,34671962.0,Abril 2024,Evento
EPSS02,SALUD TOTAL,801001323.0,INSTITUTO ESPECIALIZADO EN SALUD MENTAL IMES LTDA,Evento,9128980.0,Abril 2024,Evento
EPSS02,SALUD TOTAL,801001440.0,RED SALUD ARMENIA ESE UNIDAD INTERMEDIA DEL SUR,Evento,14162982.0,Abril 2024,Evento
EPSS02,SALUD TOTAL,802000909.0,CLINICA LOS ALMENDROS SAS,Evento,25488905.0,Abril 2024,Evento
EPSS02,SALUD TOTAL,802000955.0,INSTITUTO DE LA VISION DEL NORTE & CIA. LTDA.,Evento,58349963.0,Abril 2024,Evento
EPSS02,SALUD TOTAL,802001084.0,IPS CLINICA SANTA ANA DE BARANOA,Evento,2520523.0,Abril 2024,Evento
EPSS02,SALUD TOTAL,802001292.0,EMPRESA SOCIAL DEL ESTADO HOSPITAL DE REPELON,Evento,3545363.0,Abril 2024,Evento
EPSS02,SALUD TOTAL,802003081.0,E.S.E. HOSPITAL MUNICIPAL DE SABANAGRANDE,Evento,9560354.0,Abril 2024,Evento
EPSS02,SALUD TOTAL,802003414.0,EMPRESA SOCIAL DEL ESTADO HOSPITAL DE JUAN DE ACOSTA,Evento,3913167.0,Abril 2024,Evento
EPSS02,SALUD TOTAL,802004166.0,NEFROSERVICIOS S.A.S,Evento,19112270.0,Abril 2024,Evento
EPSS02,SALUD TOTAL,802006267.0,ESE CENTRO DE SALUD CON CAMAS DE PALMAR DE VARELA,Evento,10203391.0,Abril 2024,Evento
EPSS02,SALUD TOTAL,802007798.0,EMPRESA SOCIAL DEL ESTADO CENTRO DE SALUD DE GALAPA,Evento,4010732.0,Abril 2024,Evento
EPSS02,SALUD TOTAL,802009463.0,ESE CENTRO DE SALUD DE TUBARÁ,Evento,1636166.0,Abril 2024,Evento
EPSS02,SALUD TOTAL,802010614.0,CENTRO CANCEROLOGICO DEL CARIBE CECAC LTDA,Evento,50733184.0,Abril 2024,Evento
EPSS02,SALUD TOTAL,802015154.0,FASALUD IPS S.A.S.,Evento,14411606.0,Abril 2024,Evento
EPSS02,SALUD TOTAL,802017015.0,SOCIEDAD BERBOJ SALUD LIMITADA DE SABANALARGA,Evento,38381517.0,Abril 2024,Evento
EPSS02,SALUD TOTAL,802019573.0,CLINICA PORVENIR LIMITADA,Evento,25523087.0,Abril 2024,Evento
EPSS02,SALUD TOTAL,802020128.0,INVERCLINICAS S.A.S.,Evento,21107451.0,Abril 2024,Evento
EPSS02,SALUD TOTAL,802021182.0,I.P.S. UNIDAD MEDICA ETICA S.A.S.,Evento,13021540.0,Abril 2024,Evento
